No.     Time           Source                Destination           Protocol Length Info
      1 0.000000       192.168.0.11          192.168.0.10          DNS      76     Standard query 0x35d6 A alive.github.com

Frame 1: 76 bytes on wire (608 bits), 76 bytes captured (608 bits)
Ethernet II, Src: AzureWaveTec_76:92:9d (14:d4:24:76:92:9d), Dst: ca:58:6a:56:25:c8 (ca:58:6a:56:25:c8)
Internet Protocol Version 4, Src: 192.168.0.11, Dst: 192.168.0.10
User Datagram Protocol, Src Port: 52307, Dst Port: 53
Domain Name System (query)

No.     Time           Source                Destination           Protocol Length Info
      2 0.004688       192.168.0.10          192.168.0.11          DNS      76     Standard query response 0x35d6 No such name A alive.github.com

Frame 2: 76 bytes on wire (608 bits), 76 bytes captured (608 bits)
Ethernet II, Src: ca:58:6a:56:25:c8 (ca:58:6a:56:25:c8), Dst: AzureWaveTec_76:92:9d (14:d4:24:76:92:9d)
Internet Protocol Version 4, Src: 192.168.0.10, Dst: 192.168.0.11
User Datagram Protocol, Src Port: 53, Dst Port: 52307
Domain Name System (response)

No.     Time           Source                Destination           Protocol Length Info
      3 1.734121       192.168.0.11          192.168.0.10          DNS      70     Standard query 0x6b1c A github.com

Frame 3: 70 bytes on wire (560 bits), 70 bytes captured (560 bits)
Ethernet II, Src: AzureWaveTec_76:92:9d (14:d4:24:76:92:9d), Dst: ca:58:6a:56:25:c8 (ca:58:6a:56:25:c8)
Internet Protocol Version 4, Src: 192.168.0.11, Dst: 192.168.0.10
User Datagram Protocol, Src Port: 52307, Dst Port: 53
Domain Name System (query)

No.     Time           Source                Destination           Protocol Length Info
      4 1.736823       192.168.0.10          192.168.0.11          DNS      70     Standard query response 0x6b1c No such name A github.com

Frame 4: 70 bytes on wire (560 bits), 70 bytes captured (560 bits)
Ethernet II, Src: ca:58:6a:56:25:c8 (ca:58:6a:56:25:c8), Dst: AzureWaveTec_76:92:9d (14:d4:24:76:92:9d)
Internet Protocol Version 4, Src: 192.168.0.10, Dst: 192.168.0.11
User Datagram Protocol, Src Port: 53, Dst Port: 52307
Domain Name System (response)

No.     Time           Source                Destination           Protocol Length Info
      5 15.877279      192.168.0.11          192.168.0.10          DNS      76     Standard query 0x648a A www.msftncsi.com

Frame 5: 76 bytes on wire (608 bits), 76 bytes captured (608 bits)
Ethernet II, Src: AzureWaveTec_76:92:9d (14:d4:24:76:92:9d), Dst: ca:58:6a:56:25:c8 (ca:58:6a:56:25:c8)
Internet Protocol Version 4, Src: 192.168.0.11, Dst: 192.168.0.10
User Datagram Protocol, Src Port: 59055, Dst Port: 53
Domain Name System (query)

No.     Time           Source                Destination           Protocol Length Info
      6 15.880142      192.168.0.10          192.168.0.11          DNS      76     Standard query response 0x648a No such name A www.msftncsi.com

Frame 6: 76 bytes on wire (608 bits), 76 bytes captured (608 bits)
Ethernet II, Src: ca:58:6a:56:25:c8 (ca:58:6a:56:25:c8), Dst: AzureWaveTec_76:92:9d (14:d4:24:76:92:9d)
Internet Protocol Version 4, Src: 192.168.0.10, Dst: 192.168.0.11
User Datagram Protocol, Src Port: 53, Dst Port: 59055
Domain Name System (response)

No.     Time           Source                Destination           Protocol Length Info
      7 23.169523      192.168.0.11          192.168.0.10          DNS      74     Standard query 0x5df8 A api.github.com

Frame 7: 74 bytes on wire (592 bits), 74 bytes captured (592 bits)
Ethernet II, Src: AzureWaveTec_76:92:9d (14:d4:24:76:92:9d), Dst: ca:58:6a:56:25:c8 (ca:58:6a:56:25:c8)
Internet Protocol Version 4, Src: 192.168.0.11, Dst: 192.168.0.10
User Datagram Protocol, Src Port: 52360, Dst Port: 53
Domain Name System (query)

No.     Time           Source                Destination           Protocol Length Info
      8 23.201799      192.168.0.11          192.168.0.10          DNS      74     Standard query 0x5df8 A api.github.com

Frame 8: 74 bytes on wire (592 bits), 74 bytes captured (592 bits)
Ethernet II, Src: AzureWaveTec_76:92:9d (14:d4:24:76:92:9d), Dst: ca:58:6a:56:25:c8 (ca:58:6a:56:25:c8)
Internet Protocol Version 4, Src: 192.168.0.11, Dst: 192.168.0.10
User Datagram Protocol, Src Port: 52360, Dst Port: 53
Domain Name System (query)

No.     Time           Source                Destination           Protocol Length Info
      9 23.239997      192.168.0.10          192.168.0.11          DNS      74     Standard query response 0x5df8 No such name A api.github.com

Frame 9: 74 bytes on wire (592 bits), 74 bytes captured (592 bits)
Ethernet II, Src: ca:58:6a:56:25:c8 (ca:58:6a:56:25:c8), Dst: AzureWaveTec_76:92:9d (14:d4:24:76:92:9d)
Internet Protocol Version 4, Src: 192.168.0.10, Dst: 192.168.0.11
User Datagram Protocol, Src Port: 53, Dst Port: 52360
Domain Name System (response)

No.     Time           Source                Destination           Protocol Length Info
     10 23.240082      192.168.0.11          192.168.0.10          ICMP     102    Destination unreachable (Port unreachable)

Frame 10: 102 bytes on wire (816 bits), 102 bytes captured (816 bits)
Ethernet II, Src: AzureWaveTec_76:92:9d (14:d4:24:76:92:9d), Dst: ca:58:6a:56:25:c8 (ca:58:6a:56:25:c8)
Internet Protocol Version 4, Src: 192.168.0.11, Dst: 192.168.0.10
Internet Control Message Protocol

No.     Time           Source                Destination           Protocol Length Info
     11 27.691735      AzureWaveTec_76:92:9d ca:58:6a:56:25:c8     ARP      42     Who has 192.168.0.10? Tell 192.168.0.11

Frame 11: 42 bytes on wire (336 bits), 42 bytes captured (336 bits)
Ethernet II, Src: AzureWaveTec_76:92:9d (14:d4:24:76:92:9d), Dst: ca:58:6a:56:25:c8 (ca:58:6a:56:25:c8)
Address Resolution Protocol (request)

No.     Time           Source                Destination           Protocol Length Info
     12 27.712681      ca:58:6a:56:25:c8     AzureWaveTec_76:92:9d ARP      42     192.168.0.10 is at ca:58:6a:56:25:c8

Frame 12: 42 bytes on wire (336 bits), 42 bytes captured (336 bits)
Ethernet II, Src: ca:58:6a:56:25:c8 (ca:58:6a:56:25:c8), Dst: AzureWaveTec_76:92:9d (14:d4:24:76:92:9d)
Address Resolution Protocol (reply)

No.     Time           Source                Destination           Protocol Length Info
     13 50.879372      AzureWaveTec_76:92:9d Broadcast             ARP      42     Who has 192.168.0.10? Tell 192.168.0.11

Frame 13: 42 bytes on wire (336 bits), 42 bytes captured (336 bits)
Ethernet II, Src: AzureWaveTec_76:92:9d (14:d4:24:76:92:9d), Dst: Broadcast (ff:ff:ff:ff:ff:ff)
Address Resolution Protocol (request)

No.     Time           Source                Destination           Protocol Length Info
     14 50.894358      ca:58:6a:56:25:c8     AzureWaveTec_76:92:9d ARP      42     192.168.0.10 is at ca:58:6a:56:25:c8

Frame 14: 42 bytes on wire (336 bits), 42 bytes captured (336 bits)
Ethernet II, Src: ca:58:6a:56:25:c8 (ca:58:6a:56:25:c8), Dst: AzureWaveTec_76:92:9d (14:d4:24:76:92:9d)
Address Resolution Protocol (reply)

No.     Time           Source                Destination           Protocol Length Info
     15 50.910804      192.168.0.11          192.168.0.10          DNS      76     Standard query 0xf328 A dns.msftncsi.com

Frame 15: 76 bytes on wire (608 bits), 76 bytes captured (608 bits)
Ethernet II, Src: AzureWaveTec_76:92:9d (14:d4:24:76:92:9d), Dst: ca:58:6a:56:25:c8 (ca:58:6a:56:25:c8)
Internet Protocol Version 4, Src: 192.168.0.11, Dst: 192.168.0.10
User Datagram Protocol, Src Port: 61841, Dst Port: 53
Domain Name System (query)

No.     Time           Source                Destination           Protocol Length Info
     16 50.920923      192.168.0.10          192.168.0.11          DNS      76     Standard query response 0xf328 No such name A dns.msftncsi.com

Frame 16: 76 bytes on wire (608 bits), 76 bytes captured (608 bits)
Ethernet II, Src: ca:58:6a:56:25:c8 (ca:58:6a:56:25:c8), Dst: AzureWaveTec_76:92:9d (14:d4:24:76:92:9d)
Internet Protocol Version 4, Src: 192.168.0.10, Dst: 192.168.0.11
User Datagram Protocol, Src Port: 53, Dst Port: 61841
Domain Name System (response)

No.     Time           Source                Destination           Protocol Length Info
     17 51.428521      192.168.0.11          192.168.0.10          DNS      76     Standard query 0x5751 A www.msftncsi.com

Frame 17: 76 bytes on wire (608 bits), 76 bytes captured (608 bits)
Ethernet II, Src: AzureWaveTec_76:92:9d (14:d4:24:76:92:9d), Dst: ca:58:6a:56:25:c8 (ca:58:6a:56:25:c8)
Internet Protocol Version 4, Src: 192.168.0.11, Dst: 192.168.0.10
User Datagram Protocol, Src Port: 61841, Dst Port: 53
Domain Name System (query)

No.     Time           Source                Destination           Protocol Length Info
     18 51.428900      192.168.0.11          192.168.0.10          DNS      76     Standard query 0x7472 A www.msftncsi.com

Frame 18: 76 bytes on wire (608 bits), 76 bytes captured (608 bits)
Ethernet II, Src: AzureWaveTec_76:92:9d (14:d4:24:76:92:9d), Dst: ca:58:6a:56:25:c8 (ca:58:6a:56:25:c8)
Internet Protocol Version 4, Src: 192.168.0.11, Dst: 192.168.0.10
User Datagram Protocol, Src Port: 52888, Dst Port: 53
Domain Name System (query)

No.     Time           Source                Destination           Protocol Length Info
     19 51.443632      192.168.0.10          192.168.0.11          DNS      76     Standard query response 0x5751 No such name A www.msftncsi.com

Frame 19: 76 bytes on wire (608 bits), 76 bytes captured (608 bits)
Ethernet II, Src: ca:58:6a:56:25:c8 (ca:58:6a:56:25:c8), Dst: AzureWaveTec_76:92:9d (14:d4:24:76:92:9d)
Internet Protocol Version 4, Src: 192.168.0.10, Dst: 192.168.0.11
User Datagram Protocol, Src Port: 53, Dst Port: 61841
Domain Name System (response)

No.     Time           Source                Destination           Protocol Length Info
     20 51.444952      192.168.0.10          192.168.0.11          DNS      76     Standard query response 0x7472 No such name A www.msftncsi.com

Frame 20: 76 bytes on wire (608 bits), 76 bytes captured (608 bits)
Ethernet II, Src: ca:58:6a:56:25:c8 (ca:58:6a:56:25:c8), Dst: AzureWaveTec_76:92:9d (14:d4:24:76:92:9d)
Internet Protocol Version 4, Src: 192.168.0.10, Dst: 192.168.0.11
User Datagram Protocol, Src Port: 53, Dst Port: 52888
Domain Name System (response)

No.     Time           Source                Destination           Protocol Length Info
     21 54.680040      192.168.0.11          192.168.0.10          DNS      83     Standard query 0x1d96 A www.msftconnecttest.com

Frame 21: 83 bytes on wire (664 bits), 83 bytes captured (664 bits)
Ethernet II, Src: AzureWaveTec_76:92:9d (14:d4:24:76:92:9d), Dst: ca:58:6a:56:25:c8 (ca:58:6a:56:25:c8)
Internet Protocol Version 4, Src: 192.168.0.11, Dst: 192.168.0.10
User Datagram Protocol, Src Port: 61841, Dst Port: 53
Domain Name System (query)

No.     Time           Source                Destination           Protocol Length Info
     22 54.697682      192.168.0.10          192.168.0.11          DNS      83     Standard query response 0x1d96 No such name A www.msftconnecttest.com

Frame 22: 83 bytes on wire (664 bits), 83 bytes captured (664 bits)
Ethernet II, Src: ca:58:6a:56:25:c8 (ca:58:6a:56:25:c8), Dst: AzureWaveTec_76:92:9d (14:d4:24:76:92:9d)
Internet Protocol Version 4, Src: 192.168.0.10, Dst: 192.168.0.11
User Datagram Protocol, Src Port: 53, Dst Port: 61841
Domain Name System (response)

No.     Time           Source                Destination           Protocol Length Info
     23 60.290669      192.168.0.11          192.168.0.10          DNS      79     Standard query 0x6f78 A main.vscode-cdn.net

Frame 23: 79 bytes on wire (632 bits), 79 bytes captured (632 bits)
Ethernet II, Src: AzureWaveTec_76:92:9d (14:d4:24:76:92:9d), Dst: ca:58:6a:56:25:c8 (ca:58:6a:56:25:c8)
Internet Protocol Version 4, Src: 192.168.0.11, Dst: 192.168.0.10
User Datagram Protocol, Src Port: 52888, Dst Port: 53
Domain Name System (query)

No.     Time           Source                Destination           Protocol Length Info
     24 60.299673      192.168.0.10          192.168.0.11          DNS      79     Standard query response 0x6f78 No such name A main.vscode-cdn.net

Frame 24: 79 bytes on wire (632 bits), 79 bytes captured (632 bits)
Ethernet II, Src: ca:58:6a:56:25:c8 (ca:58:6a:56:25:c8), Dst: AzureWaveTec_76:92:9d (14:d4:24:76:92:9d)
Internet Protocol Version 4, Src: 192.168.0.10, Dst: 192.168.0.11
User Datagram Protocol, Src Port: 53, Dst Port: 52888
Domain Name System (response)

No.     Time           Source                Destination           Protocol Length Info
     25 89.692960      AzureWaveTec_76:92:9d Broadcast             ARP      42     Who has 192.168.0.10? Tell 192.168.0.11

Frame 25: 42 bytes on wire (336 bits), 42 bytes captured (336 bits)
Ethernet II, Src: AzureWaveTec_76:92:9d (14:d4:24:76:92:9d), Dst: Broadcast (ff:ff:ff:ff:ff:ff)
Address Resolution Protocol (request)

No.     Time           Source                Destination           Protocol Length Info
     26 89.715464      ca:58:6a:56:25:c8     AzureWaveTec_76:92:9d ARP      42     192.168.0.10 is at ca:58:6a:56:25:c8

Frame 26: 42 bytes on wire (336 bits), 42 bytes captured (336 bits)
Ethernet II, Src: ca:58:6a:56:25:c8 (ca:58:6a:56:25:c8), Dst: AzureWaveTec_76:92:9d (14:d4:24:76:92:9d)
Address Resolution Protocol (reply)

No.     Time           Source                Destination           Protocol Length Info
     27 89.728992      192.168.0.11          192.168.0.10          DNS      76     Standard query 0x0bda A dns.msftncsi.com

Frame 27: 76 bytes on wire (608 bits), 76 bytes captured (608 bits)
Ethernet II, Src: AzureWaveTec_76:92:9d (14:d4:24:76:92:9d), Dst: ca:58:6a:56:25:c8 (ca:58:6a:56:25:c8)
Internet Protocol Version 4, Src: 192.168.0.11, Dst: 192.168.0.10
User Datagram Protocol, Src Port: 51188, Dst Port: 53
Domain Name System (query)

No.     Time           Source                Destination           Protocol Length Info
     28 89.768517      192.168.0.11          192.168.0.10          DNS      76     Standard query 0x0bda A dns.msftncsi.com

Frame 28: 76 bytes on wire (608 bits), 76 bytes captured (608 bits)
Ethernet II, Src: AzureWaveTec_76:92:9d (14:d4:24:76:92:9d), Dst: ca:58:6a:56:25:c8 (ca:58:6a:56:25:c8)
Internet Protocol Version 4, Src: 192.168.0.11, Dst: 192.168.0.10
User Datagram Protocol, Src Port: 51188, Dst Port: 53
Domain Name System (query)

No.     Time           Source                Destination           Protocol Length Info
     29 90.777077      192.168.0.11          192.168.0.10          DNS      76     Standard query 0x0bda A dns.msftncsi.com

Frame 29: 76 bytes on wire (608 bits), 76 bytes captured (608 bits)
Ethernet II, Src: AzureWaveTec_76:92:9d (14:d4:24:76:92:9d), Dst: ca:58:6a:56:25:c8 (ca:58:6a:56:25:c8)
Internet Protocol Version 4, Src: 192.168.0.11, Dst: 192.168.0.10
User Datagram Protocol, Src Port: 51188, Dst Port: 53
Domain Name System (query)

No.     Time           Source                Destination           Protocol Length Info
     30 92.784925      192.168.0.11          192.168.0.10          DNS      76     Standard query 0x0bda A dns.msftncsi.com

Frame 30: 76 bytes on wire (608 bits), 76 bytes captured (608 bits)
Ethernet II, Src: AzureWaveTec_76:92:9d (14:d4:24:76:92:9d), Dst: ca:58:6a:56:25:c8 (ca:58:6a:56:25:c8)
Internet Protocol Version 4, Src: 192.168.0.11, Dst: 192.168.0.10
User Datagram Protocol, Src Port: 51188, Dst Port: 53
Domain Name System (query)

No.     Time           Source                Destination           Protocol Length Info
     31 96.791374      192.168.0.11          192.168.0.10          DNS      76     Standard query 0x0bda A dns.msftncsi.com

Frame 31: 76 bytes on wire (608 bits), 76 bytes captured (608 bits)
Ethernet II, Src: AzureWaveTec_76:92:9d (14:d4:24:76:92:9d), Dst: ca:58:6a:56:25:c8 (ca:58:6a:56:25:c8)
Internet Protocol Version 4, Src: 192.168.0.11, Dst: 192.168.0.10
User Datagram Protocol, Src Port: 51188, Dst Port: 53
Domain Name System (query)

No.     Time           Source                Destination           Protocol Length Info
     32 96.802590      192.168.0.10          192.168.0.11          DNS      76     Standard query response 0x0bda No such name A dns.msftncsi.com

Frame 32: 76 bytes on wire (608 bits), 76 bytes captured (608 bits)
Ethernet II, Src: ca:58:6a:56:25:c8 (ca:58:6a:56:25:c8), Dst: AzureWaveTec_76:92:9d (14:d4:24:76:92:9d)
Internet Protocol Version 4, Src: 192.168.0.10, Dst: 192.168.0.11
User Datagram Protocol, Src Port: 53, Dst Port: 51188
Domain Name System (response)

No.     Time           Source                Destination           Protocol Length Info
     33 97.308144      192.168.0.11          192.168.0.10          DNS      83     Standard query 0x0854 A www.msftconnecttest.com

Frame 33: 83 bytes on wire (664 bits), 83 bytes captured (664 bits)
Ethernet II, Src: AzureWaveTec_76:92:9d (14:d4:24:76:92:9d), Dst: ca:58:6a:56:25:c8 (ca:58:6a:56:25:c8)
Internet Protocol Version 4, Src: 192.168.0.11, Dst: 192.168.0.10
User Datagram Protocol, Src Port: 55084, Dst Port: 53
Domain Name System (query)

No.     Time           Source                Destination           Protocol Length Info
     34 97.308280      192.168.0.11          192.168.0.10          DNS      83     Standard query 0xaa4a A www.msftconnecttest.com

Frame 34: 83 bytes on wire (664 bits), 83 bytes captured (664 bits)
Ethernet II, Src: AzureWaveTec_76:92:9d (14:d4:24:76:92:9d), Dst: ca:58:6a:56:25:c8 (ca:58:6a:56:25:c8)
Internet Protocol Version 4, Src: 192.168.0.11, Dst: 192.168.0.10
User Datagram Protocol, Src Port: 54383, Dst Port: 53
Domain Name System (query)

No.     Time           Source                Destination           Protocol Length Info
     35 97.311343      192.168.0.10          192.168.0.11          DNS      83     Standard query response 0x0854 No such name A www.msftconnecttest.com

Frame 35: 83 bytes on wire (664 bits), 83 bytes captured (664 bits)
Ethernet II, Src: ca:58:6a:56:25:c8 (ca:58:6a:56:25:c8), Dst: AzureWaveTec_76:92:9d (14:d4:24:76:92:9d)
Internet Protocol Version 4, Src: 192.168.0.10, Dst: 192.168.0.11
User Datagram Protocol, Src Port: 53, Dst Port: 55084
Domain Name System (response)

No.     Time           Source                Destination           Protocol Length Info
     36 97.312789      192.168.0.10          192.168.0.11          DNS      83     Standard query response 0xaa4a No such name A www.msftconnecttest.com

Frame 36: 83 bytes on wire (664 bits), 83 bytes captured (664 bits)
Ethernet II, Src: ca:58:6a:56:25:c8 (ca:58:6a:56:25:c8), Dst: AzureWaveTec_76:92:9d (14:d4:24:76:92:9d)
Internet Protocol Version 4, Src: 192.168.0.10, Dst: 192.168.0.11
User Datagram Protocol, Src Port: 53, Dst Port: 54383
Domain Name System (response)

No.     Time           Source                Destination           Protocol Length Info
     37 117.196371     192.168.0.11          192.168.0.10          DNS      72     Standard query 0xb341 A www.bing.com

Frame 37: 72 bytes on wire (576 bits), 72 bytes captured (576 bits)
Ethernet II, Src: AzureWaveTec_76:92:9d (14:d4:24:76:92:9d), Dst: ca:58:6a:56:25:c8 (ca:58:6a:56:25:c8)
Internet Protocol Version 4, Src: 192.168.0.11, Dst: 192.168.0.10
User Datagram Protocol, Src Port: 54383, Dst Port: 53
Domain Name System (query)

No.     Time           Source                Destination           Protocol Length Info
     38 117.227868     192.168.0.11          192.168.0.10          DNS      72     Standard query 0xb341 A www.bing.com

Frame 38: 72 bytes on wire (576 bits), 72 bytes captured (576 bits)
Ethernet II, Src: AzureWaveTec_76:92:9d (14:d4:24:76:92:9d), Dst: ca:58:6a:56:25:c8 (ca:58:6a:56:25:c8)
Internet Protocol Version 4, Src: 192.168.0.11, Dst: 192.168.0.10
User Datagram Protocol, Src Port: 54383, Dst Port: 53
Domain Name System (query)

No.     Time           Source                Destination           Protocol Length Info
     39 117.261667     192.168.0.10          192.168.0.11          DNS      72     Standard query response 0xb341 No such name A www.bing.com

Frame 39: 72 bytes on wire (576 bits), 72 bytes captured (576 bits)
Ethernet II, Src: ca:58:6a:56:25:c8 (ca:58:6a:56:25:c8), Dst: AzureWaveTec_76:92:9d (14:d4:24:76:92:9d)
Internet Protocol Version 4, Src: 192.168.0.10, Dst: 192.168.0.11
User Datagram Protocol, Src Port: 53, Dst Port: 54383
Domain Name System (response)

No.     Time           Source                Destination           Protocol Length Info
     40 117.261712     192.168.0.11          192.168.0.10          ICMP     100    Destination unreachable (Port unreachable)

Frame 40: 100 bytes on wire (800 bits), 100 bytes captured (800 bits)
Ethernet II, Src: AzureWaveTec_76:92:9d (14:d4:24:76:92:9d), Dst: ca:58:6a:56:25:c8 (ca:58:6a:56:25:c8)
Internet Protocol Version 4, Src: 192.168.0.11, Dst: 192.168.0.10
Internet Control Message Protocol

No.     Time           Source                Destination           Protocol Length Info
     41 117.264328     192.168.0.10          192.168.0.11          DNS      72     Standard query response 0xb341 No such name A www.bing.com

Frame 41: 72 bytes on wire (576 bits), 72 bytes captured (576 bits)
Ethernet II, Src: ca:58:6a:56:25:c8 (ca:58:6a:56:25:c8), Dst: AzureWaveTec_76:92:9d (14:d4:24:76:92:9d)
Internet Protocol Version 4, Src: 192.168.0.10, Dst: 192.168.0.11
User Datagram Protocol, Src Port: 53, Dst Port: 54383
Domain Name System (response)

No.     Time           Source                Destination           Protocol Length Info
     42 118.071305     192.168.0.11          192.168.0.10          DNS      91     Standard query 0xc3ab A browser.pipe.aria.microsoft.com

Frame 42: 91 bytes on wire (728 bits), 91 bytes captured (728 bits)
Ethernet II, Src: AzureWaveTec_76:92:9d (14:d4:24:76:92:9d), Dst: ca:58:6a:56:25:c8 (ca:58:6a:56:25:c8)
Internet Protocol Version 4, Src: 192.168.0.11, Dst: 192.168.0.10
User Datagram Protocol, Src Port: 53366, Dst Port: 53
Domain Name System (query)

No.     Time           Source                Destination           Protocol Length Info
     43 118.080625     192.168.0.10          192.168.0.11          DNS      91     Standard query response 0xc3ab No such name A browser.pipe.aria.microsoft.com

Frame 43: 91 bytes on wire (728 bits), 91 bytes captured (728 bits)
Ethernet II, Src: ca:58:6a:56:25:c8 (ca:58:6a:56:25:c8), Dst: AzureWaveTec_76:92:9d (14:d4:24:76:92:9d)
Internet Protocol Version 4, Src: 192.168.0.10, Dst: 192.168.0.11
User Datagram Protocol, Src Port: 53, Dst Port: 53366
Domain Name System (response)

No.     Time           Source                Destination           Protocol Length Info
     44 123.247607     192.168.0.11          192.168.0.10          DNS      91     Standard query 0xc699 A dual-s-ring-fallback.msedge.net

Frame 44: 91 bytes on wire (728 bits), 91 bytes captured (728 bits)
Ethernet II, Src: AzureWaveTec_76:92:9d (14:d4:24:76:92:9d), Dst: ca:58:6a:56:25:c8 (ca:58:6a:56:25:c8)
Internet Protocol Version 4, Src: 192.168.0.11, Dst: 192.168.0.10
User Datagram Protocol, Src Port: 53366, Dst Port: 53
Domain Name System (query)

No.     Time           Source                Destination           Protocol Length Info
     45 123.250775     192.168.0.10          192.168.0.11          DNS      91     Standard query response 0xc699 No such name A dual-s-ring-fallback.msedge.net

Frame 45: 91 bytes on wire (728 bits), 91 bytes captured (728 bits)
Ethernet II, Src: ca:58:6a:56:25:c8 (ca:58:6a:56:25:c8), Dst: AzureWaveTec_76:92:9d (14:d4:24:76:92:9d)
Internet Protocol Version 4, Src: 192.168.0.10, Dst: 192.168.0.11
User Datagram Protocol, Src Port: 53, Dst Port: 53366
Domain Name System (response)

No.     Time           Source                Destination           Protocol Length Info
     46 123.729955     192.168.0.11          192.168.0.10          DNS      78     Standard query 0x756d A ln-ring.msedge.net

Frame 46: 78 bytes on wire (624 bits), 78 bytes captured (624 bits)
Ethernet II, Src: AzureWaveTec_76:92:9d (14:d4:24:76:92:9d), Dst: ca:58:6a:56:25:c8 (ca:58:6a:56:25:c8)
Internet Protocol Version 4, Src: 192.168.0.11, Dst: 192.168.0.10
User Datagram Protocol, Src Port: 53366, Dst Port: 53
Domain Name System (query)

No.     Time           Source                Destination           Protocol Length Info
     47 123.732991     192.168.0.10          192.168.0.11          DNS      78     Standard query response 0x756d No such name A ln-ring.msedge.net

Frame 47: 78 bytes on wire (624 bits), 78 bytes captured (624 bits)
Ethernet II, Src: ca:58:6a:56:25:c8 (ca:58:6a:56:25:c8), Dst: AzureWaveTec_76:92:9d (14:d4:24:76:92:9d)
Internet Protocol Version 4, Src: 192.168.0.10, Dst: 192.168.0.11
User Datagram Protocol, Src Port: 53, Dst Port: 53366
Domain Name System (response)

No.     Time           Source                Destination           Protocol Length Info
     48 123.923595     192.168.0.11          192.168.0.10          DNS      81     Standard query 0x8db5 A ow1.res.office365.com

Frame 48: 81 bytes on wire (648 bits), 81 bytes captured (648 bits)
Ethernet II, Src: AzureWaveTec_76:92:9d (14:d4:24:76:92:9d), Dst: ca:58:6a:56:25:c8 (ca:58:6a:56:25:c8)
Internet Protocol Version 4, Src: 192.168.0.11, Dst: 192.168.0.10
User Datagram Protocol, Src Port: 53366, Dst Port: 53
Domain Name System (query)

No.     Time           Source                Destination           Protocol Length Info
     49 123.926769     192.168.0.10          192.168.0.11          DNS      81     Standard query response 0x8db5 No such name A ow1.res.office365.com

Frame 49: 81 bytes on wire (648 bits), 81 bytes captured (648 bits)
Ethernet II, Src: ca:58:6a:56:25:c8 (ca:58:6a:56:25:c8), Dst: AzureWaveTec_76:92:9d (14:d4:24:76:92:9d)
Internet Protocol Version 4, Src: 192.168.0.10, Dst: 192.168.0.11
User Datagram Protocol, Src Port: 53, Dst Port: 53366
Domain Name System (response)

No.     Time           Source                Destination           Protocol Length Info
     50 124.145752     192.168.0.11          192.168.0.10          DNS      73     Standard query 0x385c A fp.msedge.net

Frame 50: 73 bytes on wire (584 bits), 73 bytes captured (584 bits)
Ethernet II, Src: AzureWaveTec_76:92:9d (14:d4:24:76:92:9d), Dst: ca:58:6a:56:25:c8 (ca:58:6a:56:25:c8)
Internet Protocol Version 4, Src: 192.168.0.11, Dst: 192.168.0.10
User Datagram Protocol, Src Port: 53366, Dst Port: 53
Domain Name System (query)

No.     Time           Source                Destination           Protocol Length Info
     51 124.148622     192.168.0.10          192.168.0.11          DNS      73     Standard query response 0x385c No such name A fp.msedge.net

Frame 51: 73 bytes on wire (584 bits), 73 bytes captured (584 bits)
Ethernet II, Src: ca:58:6a:56:25:c8 (ca:58:6a:56:25:c8), Dst: AzureWaveTec_76:92:9d (14:d4:24:76:92:9d)
Internet Protocol Version 4, Src: 192.168.0.10, Dst: 192.168.0.11
User Datagram Protocol, Src Port: 53, Dst Port: 53366
Domain Name System (response)

No.     Time           Source                Destination           Protocol Length Info
     52 125.098245     192.168.0.11          192.168.0.10          DNS      80     Standard query 0xcdb3 A events.appsflyer.com

Frame 52: 80 bytes on wire (640 bits), 80 bytes captured (640 bits)
Ethernet II, Src: AzureWaveTec_76:92:9d (14:d4:24:76:92:9d), Dst: ca:58:6a:56:25:c8 (ca:58:6a:56:25:c8)
Internet Protocol Version 4, Src: 192.168.0.11, Dst: 192.168.0.10
User Datagram Protocol, Src Port: 53366, Dst Port: 53
Domain Name System (query)

No.     Time           Source                Destination           Protocol Length Info
     53 125.101159     192.168.0.10          192.168.0.11          DNS      80     Standard query response 0xcdb3 No such name A events.appsflyer.com

Frame 53: 80 bytes on wire (640 bits), 80 bytes captured (640 bits)
Ethernet II, Src: ca:58:6a:56:25:c8 (ca:58:6a:56:25:c8), Dst: AzureWaveTec_76:92:9d (14:d4:24:76:92:9d)
Internet Protocol Version 4, Src: 192.168.0.10, Dst: 192.168.0.11
User Datagram Protocol, Src Port: 53, Dst Port: 53366
Domain Name System (response)

No.     Time           Source                Destination           Protocol Length Info
     54 126.187186     192.168.0.11          192.168.0.10          DNS      91     Standard query 0xdb80 A fe3cr.delivery.mp.microsoft.com

Frame 54: 91 bytes on wire (728 bits), 91 bytes captured (728 bits)
Ethernet II, Src: AzureWaveTec_76:92:9d (14:d4:24:76:92:9d), Dst: ca:58:6a:56:25:c8 (ca:58:6a:56:25:c8)
Internet Protocol Version 4, Src: 192.168.0.11, Dst: 192.168.0.10
User Datagram Protocol, Src Port: 53366, Dst Port: 53
Domain Name System (query)

No.     Time           Source                Destination           Protocol Length Info
     55 126.190326     192.168.0.10          192.168.0.11          DNS      91     Standard query response 0xdb80 No such name A fe3cr.delivery.mp.microsoft.com

Frame 55: 91 bytes on wire (728 bits), 91 bytes captured (728 bits)
Ethernet II, Src: ca:58:6a:56:25:c8 (ca:58:6a:56:25:c8), Dst: AzureWaveTec_76:92:9d (14:d4:24:76:92:9d)
Internet Protocol Version 4, Src: 192.168.0.10, Dst: 192.168.0.11
User Datagram Protocol, Src Port: 53, Dst Port: 53366
Domain Name System (response)

No.     Time           Source                Destination           Protocol Length Info
     56 128.197554     AzureWaveTec_76:92:9d ca:58:6a:56:25:c8     ARP      42     Who has 192.168.0.10? Tell 192.168.0.11

Frame 56: 42 bytes on wire (336 bits), 42 bytes captured (336 bits)
Ethernet II, Src: AzureWaveTec_76:92:9d (14:d4:24:76:92:9d), Dst: ca:58:6a:56:25:c8 (ca:58:6a:56:25:c8)
Address Resolution Protocol (request)

No.     Time           Source                Destination           Protocol Length Info
     57 128.200245     ca:58:6a:56:25:c8     AzureWaveTec_76:92:9d ARP      42     192.168.0.10 is at ca:58:6a:56:25:c8

Frame 57: 42 bytes on wire (336 bits), 42 bytes captured (336 bits)
Ethernet II, Src: ca:58:6a:56:25:c8 (ca:58:6a:56:25:c8), Dst: AzureWaveTec_76:92:9d (14:d4:24:76:92:9d)
Address Resolution Protocol (reply)

No.     Time           Source                Destination           Protocol Length Info
     58 129.944751     192.168.0.11          192.168.0.10          DNS      89     Standard query 0x6b1e A v10.events.data.microsoft.com

Frame 58: 89 bytes on wire (712 bits), 89 bytes captured (712 bits)
Ethernet II, Src: AzureWaveTec_76:92:9d (14:d4:24:76:92:9d), Dst: ca:58:6a:56:25:c8 (ca:58:6a:56:25:c8)
Internet Protocol Version 4, Src: 192.168.0.11, Dst: 192.168.0.10
User Datagram Protocol, Src Port: 53366, Dst Port: 53
Domain Name System (query)

No.     Time           Source                Destination           Protocol Length Info
     59 129.957991     192.168.0.10          192.168.0.11          DNS      89     Standard query response 0x6b1e No such name A v10.events.data.microsoft.com

Frame 59: 89 bytes on wire (712 bits), 89 bytes captured (712 bits)
Ethernet II, Src: ca:58:6a:56:25:c8 (ca:58:6a:56:25:c8), Dst: AzureWaveTec_76:92:9d (14:d4:24:76:92:9d)
Internet Protocol Version 4, Src: 192.168.0.10, Dst: 192.168.0.11
User Datagram Protocol, Src Port: 53, Dst Port: 53366
Domain Name System (response)

No.     Time           Source                Destination           Protocol Length Info
     60 131.536755     192.168.0.11          192.168.0.10          TCP      66     61361 → 35000 [SYN] Seq=0 Win=65535 Len=0 MSS=1460 WS=256 SACK_PERM

Frame 60: 66 bytes on wire (528 bits), 66 bytes captured (528 bits)
Ethernet II, Src: AzureWaveTec_76:92:9d (14:d4:24:76:92:9d), Dst: ca:58:6a:56:25:c8 (ca:58:6a:56:25:c8)
Internet Protocol Version 4, Src: 192.168.0.11, Dst: 192.168.0.10
Transmission Control Protocol, Src Port: 61361, Dst Port: 35000, Seq: 0, Len: 0

No.     Time           Source                Destination           Protocol Length Info
     61 131.539678     192.168.0.10          192.168.0.11          TCP      58     35000 → 61361 [SYN, ACK] Seq=0 Ack=1 Win=6144 Len=0 MSS=1024

Frame 61: 58 bytes on wire (464 bits), 58 bytes captured (464 bits)
Ethernet II, Src: ca:58:6a:56:25:c8 (ca:58:6a:56:25:c8), Dst: AzureWaveTec_76:92:9d (14:d4:24:76:92:9d)
Internet Protocol Version 4, Src: 192.168.0.10, Dst: 192.168.0.11
Transmission Control Protocol, Src Port: 35000, Dst Port: 61361, Seq: 0, Ack: 1, Len: 0

No.     Time           Source                Destination           Protocol Length Info
     62 131.539727     192.168.0.11          192.168.0.10          TCP      54     61361 → 35000 [ACK] Seq=1 Ack=1 Win=65535 Len=0

Frame 62: 54 bytes on wire (432 bits), 54 bytes captured (432 bits)
Ethernet II, Src: AzureWaveTec_76:92:9d (14:d4:24:76:92:9d), Dst: ca:58:6a:56:25:c8 (ca:58:6a:56:25:c8)
Internet Protocol Version 4, Src: 192.168.0.11, Dst: 192.168.0.10
Transmission Control Protocol, Src Port: 61361, Dst Port: 35000, Seq: 1, Ack: 1, Len: 0

No.     Time           Source                Destination           Protocol Length Info
     63 131.590741     192.168.0.11          192.168.0.10          DNS      111    Standard query 0xc3bf A obdaiazurefunctions20240928071526.azurewebsites.net

Frame 63: 111 bytes on wire (888 bits), 111 bytes captured (888 bits)
Ethernet II, Src: AzureWaveTec_76:92:9d (14:d4:24:76:92:9d), Dst: ca:58:6a:56:25:c8 (ca:58:6a:56:25:c8)
Internet Protocol Version 4, Src: 192.168.0.11, Dst: 192.168.0.10
User Datagram Protocol, Src Port: 53366, Dst Port: 53
Domain Name System (query)

No.     Time           Source                Destination           Protocol Length Info
     64 131.595980     192.168.0.10          192.168.0.11          DNS      111    Standard query response 0xc3bf No such name A obdaiazurefunctions20240928071526.azurewebsites.net

Frame 64: 111 bytes on wire (888 bits), 111 bytes captured (888 bits)
Ethernet II, Src: ca:58:6a:56:25:c8 (ca:58:6a:56:25:c8), Dst: AzureWaveTec_76:92:9d (14:d4:24:76:92:9d)
Internet Protocol Version 4, Src: 192.168.0.10, Dst: 192.168.0.11
User Datagram Protocol, Src Port: 53, Dst Port: 53366
Domain Name System (response)

No.     Time           Source                Destination           Protocol Length Info
     65 132.841149     192.168.0.11          192.168.0.10          DNS      83     Standard query 0x4cb8 A www.msftconnecttest.com

Frame 65: 83 bytes on wire (664 bits), 83 bytes captured (664 bits)
Ethernet II, Src: AzureWaveTec_76:92:9d (14:d4:24:76:92:9d), Dst: ca:58:6a:56:25:c8 (ca:58:6a:56:25:c8)
Internet Protocol Version 4, Src: 192.168.0.11, Dst: 192.168.0.10
User Datagram Protocol, Src Port: 55084, Dst Port: 53
Domain Name System (query)

No.     Time           Source                Destination           Protocol Length Info
     66 132.841324     192.168.0.11          192.168.0.10          DNS      83     Standard query 0xab1a A www.msftconnecttest.com

Frame 66: 83 bytes on wire (664 bits), 83 bytes captured (664 bits)
Ethernet II, Src: AzureWaveTec_76:92:9d (14:d4:24:76:92:9d), Dst: ca:58:6a:56:25:c8 (ca:58:6a:56:25:c8)
Internet Protocol Version 4, Src: 192.168.0.11, Dst: 192.168.0.10
User Datagram Protocol, Src Port: 53366, Dst Port: 53
Domain Name System (query)

No.     Time           Source                Destination           Protocol Length Info
     67 132.844585     192.168.0.10          192.168.0.11          DNS      83     Standard query response 0x4cb8 No such name A www.msftconnecttest.com

Frame 67: 83 bytes on wire (664 bits), 83 bytes captured (664 bits)
Ethernet II, Src: ca:58:6a:56:25:c8 (ca:58:6a:56:25:c8), Dst: AzureWaveTec_76:92:9d (14:d4:24:76:92:9d)
Internet Protocol Version 4, Src: 192.168.0.10, Dst: 192.168.0.11
User Datagram Protocol, Src Port: 53, Dst Port: 55084
Domain Name System (response)

No.     Time           Source                Destination           Protocol Length Info
     68 132.871540     192.168.0.10          192.168.0.11          DNS      83     Standard query response 0xab1a No such name A www.msftconnecttest.com

Frame 68: 83 bytes on wire (664 bits), 83 bytes captured (664 bits)
Ethernet II, Src: ca:58:6a:56:25:c8 (ca:58:6a:56:25:c8), Dst: AzureWaveTec_76:92:9d (14:d4:24:76:92:9d)
Internet Protocol Version 4, Src: 192.168.0.10, Dst: 192.168.0.11
User Datagram Protocol, Src Port: 53, Dst Port: 53366
Domain Name System (response)

No.     Time           Source                Destination           Protocol Length Info
     69 132.914375     192.168.0.11          192.168.0.10          TCP      58     61361 → 35000 [PSH, ACK] Seq=1 Ack=1 Win=65535 Len=4

Frame 69: 58 bytes on wire (464 bits), 58 bytes captured (464 bits)
Ethernet II, Src: AzureWaveTec_76:92:9d (14:d4:24:76:92:9d), Dst: ca:58:6a:56:25:c8 (ca:58:6a:56:25:c8)
Internet Protocol Version 4, Src: 192.168.0.11, Dst: 192.168.0.10
Transmission Control Protocol, Src Port: 61361, Dst Port: 35000, Seq: 1, Ack: 1, Len: 4
Data (4 bytes)

0000  41 54 49 0d                                       ATI.

No.     Time           Source                Destination           Protocol Length Info
     70 132.954543     192.168.0.10          192.168.0.11          TCP      72     35000 → 61361 [PSH, ACK] Seq=1 Ack=5 Win=6140 Len=18

Frame 70: 72 bytes on wire (576 bits), 72 bytes captured (576 bits)
Ethernet II, Src: ca:58:6a:56:25:c8 (ca:58:6a:56:25:c8), Dst: AzureWaveTec_76:92:9d (14:d4:24:76:92:9d)
Internet Protocol Version 4, Src: 192.168.0.10, Dst: 192.168.0.11
Transmission Control Protocol, Src Port: 35000, Dst Port: 61361, Seq: 1, Ack: 5, Len: 18
Data (18 bytes)

0000  41 54 49 0d 20 4f 42 44 49 49 20 76 31 2e 35 0d   ATI. OBDII v1.5.
0010  0d 3e                                             .>

No.     Time           Source                Destination           Protocol Length Info
     71 132.971311     192.168.0.11          192.168.0.10          TCP      58     61361 → 35000 [PSH, ACK] Seq=5 Ack=19 Win=65517 Len=4

Frame 71: 58 bytes on wire (464 bits), 58 bytes captured (464 bits)
Ethernet II, Src: AzureWaveTec_76:92:9d (14:d4:24:76:92:9d), Dst: ca:58:6a:56:25:c8 (ca:58:6a:56:25:c8)
Internet Protocol Version 4, Src: 192.168.0.11, Dst: 192.168.0.10
Transmission Control Protocol, Src Port: 61361, Dst Port: 35000, Seq: 5, Ack: 19, Len: 4
Data (4 bytes)

0000  41 54 5a 0d                                       ATZ.

No.     Time           Source                Destination           Protocol Length Info
     72 133.002103     192.168.0.10          192.168.0.11          TCP      59     35000 → 61361 [PSH, ACK] Seq=19 Ack=9 Win=6136 Len=5

Frame 72: 59 bytes on wire (472 bits), 59 bytes captured (472 bits)
Ethernet II, Src: ca:58:6a:56:25:c8 (ca:58:6a:56:25:c8), Dst: AzureWaveTec_76:92:9d (14:d4:24:76:92:9d)
Internet Protocol Version 4, Src: 192.168.0.10, Dst: 192.168.0.11
Transmission Control Protocol, Src Port: 35000, Dst Port: 61361, Seq: 19, Ack: 9, Len: 5
Data (5 bytes)

0000  41 54 5a 0d fc                                    ATZ..

No.     Time           Source                Destination           Protocol Length Info
     73 133.049479     192.168.0.11          192.168.0.10          TCP      54     61361 → 35000 [ACK] Seq=9 Ack=24 Win=65512 Len=0

Frame 73: 54 bytes on wire (432 bits), 54 bytes captured (432 bits)
Ethernet II, Src: AzureWaveTec_76:92:9d (14:d4:24:76:92:9d), Dst: ca:58:6a:56:25:c8 (ca:58:6a:56:25:c8)
Internet Protocol Version 4, Src: 192.168.0.11, Dst: 192.168.0.10
Transmission Control Protocol, Src Port: 61361, Dst Port: 35000, Seq: 9, Ack: 24, Len: 0

No.     Time           Source                Destination           Protocol Length Info
     74 133.804606     192.168.0.10          192.168.0.11          TCP      70     35000 → 61361 [PSH, ACK] Seq=24 Ack=9 Win=6136 Len=16

Frame 74: 70 bytes on wire (560 bits), 70 bytes captured (560 bits)
Ethernet II, Src: ca:58:6a:56:25:c8 (ca:58:6a:56:25:c8), Dst: AzureWaveTec_76:92:9d (14:d4:24:76:92:9d)
Internet Protocol Version 4, Src: 192.168.0.10, Dst: 192.168.0.11
Transmission Control Protocol, Src Port: 35000, Dst Port: 61361, Seq: 24, Ack: 9, Len: 16
Data (16 bytes)

0000  0d 0d 20 4f 42 44 49 49 20 76 31 2e 35 0d 0d 3e   .. OBDII v1.5..>

