No.     Time           Source                Destination           Protocol Length Info
      1 0.000000       192.168.0.11          192.168.0.10          TCP      66     64601 → 35000 [SYN] Seq=0 Win=65535 Len=0 MSS=1460 WS=256 SACK_PERM

Frame 1: 66 bytes on wire (528 bits), 66 bytes captured (528 bits) on interface \Device\NPF_{F1F912BA-5843-4D7F-BEA7-0E733C5F1DA8}, id 0
Ethernet II, Src: AzureWaveTec_76:92:9d (14:d4:24:76:92:9d), Dst: ca:58:6a:56:25:c8 (ca:58:6a:56:25:c8)
Internet Protocol Version 4, Src: 192.168.0.11, Dst: 192.168.0.10
Transmission Control Protocol, Src Port: 64601, Dst Port: 35000, Seq: 0, Len: 0

No.     Time           Source                Destination           Protocol Length Info
      2 0.003037       192.168.0.10          192.168.0.11          TCP      58     35000 → 64601 [SYN, ACK] Seq=0 Ack=1 Win=6144 Len=0 MSS=1024

Frame 2: 58 bytes on wire (464 bits), 58 bytes captured (464 bits) on interface \Device\NPF_{F1F912BA-5843-4D7F-BEA7-0E733C5F1DA8}, id 0
Ethernet II, Src: ca:58:6a:56:25:c8 (ca:58:6a:56:25:c8), Dst: AzureWaveTec_76:92:9d (14:d4:24:76:92:9d)
Internet Protocol Version 4, Src: 192.168.0.10, Dst: 192.168.0.11
Transmission Control Protocol, Src Port: 35000, Dst Port: 64601, Seq: 0, Ack: 1, Len: 0

No.     Time           Source                Destination           Protocol Length Info
      3 0.003101       192.168.0.11          192.168.0.10          TCP      54     64601 → 35000 [ACK] Seq=1 Ack=1 Win=65535 Len=0

Frame 3: 54 bytes on wire (432 bits), 54 bytes captured (432 bits) on interface \Device\NPF_{F1F912BA-5843-4D7F-BEA7-0E733C5F1DA8}, id 0
Ethernet II, Src: AzureWaveTec_76:92:9d (14:d4:24:76:92:9d), Dst: ca:58:6a:56:25:c8 (ca:58:6a:56:25:c8)
Internet Protocol Version 4, Src: 192.168.0.11, Dst: 192.168.0.10
Transmission Control Protocol, Src Port: 64601, Dst Port: 35000, Seq: 1, Ack: 1, Len: 0

No.     Time           Source                Destination           Protocol Length Info
      4 0.277363       192.168.0.11          192.168.0.10          TCP      58     64601 → 35000 [PSH, ACK] Seq=1 Ack=1 Win=65535 Len=4

Frame 4: 58 bytes on wire (464 bits), 58 bytes captured (464 bits) on interface \Device\NPF_{F1F912BA-5843-4D7F-BEA7-0E733C5F1DA8}, id 0
Ethernet II, Src: AzureWaveTec_76:92:9d (14:d4:24:76:92:9d), Dst: ca:58:6a:56:25:c8 (ca:58:6a:56:25:c8)
Internet Protocol Version 4, Src: 192.168.0.11, Dst: 192.168.0.10
Transmission Control Protocol, Src Port: 64601, Dst Port: 35000, Seq: 1, Ack: 1, Len: 4
Data (4 bytes)

0000  41 54 49 0d                                       ATI.

No.     Time           Source                Destination           Protocol Length Info
      5 0.290825       192.168.0.10          192.168.0.11          TCP      54     35000 → 64601 [ACK] Seq=1 Ack=5 Win=6140 Len=0

Frame 5: 54 bytes on wire (432 bits), 54 bytes captured (432 bits) on interface \Device\NPF_{F1F912BA-5843-4D7F-BEA7-0E733C5F1DA8}, id 0
Ethernet II, Src: ca:58:6a:56:25:c8 (ca:58:6a:56:25:c8), Dst: AzureWaveTec_76:92:9d (14:d4:24:76:92:9d)
Internet Protocol Version 4, Src: 192.168.0.10, Dst: 192.168.0.11
Transmission Control Protocol, Src Port: 35000, Dst Port: 64601, Seq: 1, Ack: 5, Len: 0

No.     Time           Source                Destination           Protocol Length Info
      6 0.310991       192.168.0.10          192.168.0.11          TCP      72     35000 → 64601 [PSH, ACK] Seq=1 Ack=5 Win=6140 Len=18

Frame 6: 72 bytes on wire (576 bits), 72 bytes captured (576 bits) on interface \Device\NPF_{F1F912BA-5843-4D7F-BEA7-0E733C5F1DA8}, id 0
Ethernet II, Src: ca:58:6a:56:25:c8 (ca:58:6a:56:25:c8), Dst: AzureWaveTec_76:92:9d (14:d4:24:76:92:9d)
Internet Protocol Version 4, Src: 192.168.0.10, Dst: 192.168.0.11
Transmission Control Protocol, Src Port: 35000, Dst Port: 64601, Seq: 1, Ack: 5, Len: 18
Data (18 bytes)

0000  41 54 49 0d 20 4f 42 44 49 49 20 76 31 2e 35 0d   ATI. OBDII v1.5.
0010  0d 3e                                             .>

No.     Time           Source                Destination           Protocol Length Info
      7 0.315033       192.168.0.11          192.168.0.10          TCP      58     64601 → 35000 [PSH, ACK] Seq=5 Ack=19 Win=65517 Len=4

Frame 7: 58 bytes on wire (464 bits), 58 bytes captured (464 bits) on interface \Device\NPF_{F1F912BA-5843-4D7F-BEA7-0E733C5F1DA8}, id 0
Ethernet II, Src: AzureWaveTec_76:92:9d (14:d4:24:76:92:9d), Dst: ca:58:6a:56:25:c8 (ca:58:6a:56:25:c8)
Internet Protocol Version 4, Src: 192.168.0.11, Dst: 192.168.0.10
Transmission Control Protocol, Src Port: 64601, Dst Port: 35000, Seq: 5, Ack: 19, Len: 4
Data (4 bytes)

0000  41 54 5a 0d                                       ATZ.

No.     Time           Source                Destination           Protocol Length Info
      8 0.346946       192.168.0.10          192.168.0.11          TCP      59     35000 → 64601 [PSH, ACK] Seq=19 Ack=9 Win=6136 Len=5

Frame 8: 59 bytes on wire (472 bits), 59 bytes captured (472 bits) on interface \Device\NPF_{F1F912BA-5843-4D7F-BEA7-0E733C5F1DA8}, id 0
Ethernet II, Src: ca:58:6a:56:25:c8 (ca:58:6a:56:25:c8), Dst: AzureWaveTec_76:92:9d (14:d4:24:76:92:9d)
Internet Protocol Version 4, Src: 192.168.0.10, Dst: 192.168.0.11
Transmission Control Protocol, Src Port: 35000, Dst Port: 64601, Seq: 19, Ack: 9, Len: 5
Data (5 bytes)

0000  41 54 5a 0d fc                                    ATZ..

No.     Time           Source                Destination           Protocol Length Info
      9 0.401855       192.168.0.11          192.168.0.10          TCP      54     64601 → 35000 [ACK] Seq=9 Ack=24 Win=65512 Len=0

Frame 9: 54 bytes on wire (432 bits), 54 bytes captured (432 bits) on interface \Device\NPF_{F1F912BA-5843-4D7F-BEA7-0E733C5F1DA8}, id 0
Ethernet II, Src: AzureWaveTec_76:92:9d (14:d4:24:76:92:9d), Dst: ca:58:6a:56:25:c8 (ca:58:6a:56:25:c8)
Internet Protocol Version 4, Src: 192.168.0.11, Dst: 192.168.0.10
Transmission Control Protocol, Src Port: 64601, Dst Port: 35000, Seq: 9, Ack: 24, Len: 0

No.     Time           Source                Destination           Protocol Length Info
     10 1.149048       192.168.0.10          192.168.0.11          TCP      70     35000 → 64601 [PSH, ACK] Seq=24 Ack=9 Win=6136 Len=16

Frame 10: 70 bytes on wire (560 bits), 70 bytes captured (560 bits) on interface \Device\NPF_{F1F912BA-5843-4D7F-BEA7-0E733C5F1DA8}, id 0
Ethernet II, Src: ca:58:6a:56:25:c8 (ca:58:6a:56:25:c8), Dst: AzureWaveTec_76:92:9d (14:d4:24:76:92:9d)
Internet Protocol Version 4, Src: 192.168.0.10, Dst: 192.168.0.11
Transmission Control Protocol, Src Port: 35000, Dst Port: 64601, Seq: 24, Ack: 9, Len: 16
Data (16 bytes)

0000  0d 0d 20 4f 42 44 49 49 20 76 31 2e 35 0d 0d 3e   .. OBDII v1.5..>

No.     Time           Source                Destination           Protocol Length Info
     11 1.151080       192.168.0.11          192.168.0.10          TCP      59     64601 → 35000 [PSH, ACK] Seq=9 Ack=40 Win=65496 Len=5

Frame 11: 59 bytes on wire (472 bits), 59 bytes captured (472 bits) on interface \Device\NPF_{F1F912BA-5843-4D7F-BEA7-0E733C5F1DA8}, id 0
Ethernet II, Src: AzureWaveTec_76:92:9d (14:d4:24:76:92:9d), Dst: ca:58:6a:56:25:c8 (ca:58:6a:56:25:c8)
Internet Protocol Version 4, Src: 192.168.0.11, Dst: 192.168.0.10
Transmission Control Protocol, Src Port: 64601, Dst Port: 35000, Seq: 9, Ack: 40, Len: 5
Data (5 bytes)

0000  41 54 50 43 0d                                    ATPC.

No.     Time           Source                Destination           Protocol Length Info
     12 1.182920       192.168.0.10          192.168.0.11          TCP      64     35000 → 64601 [PSH, ACK] Seq=40 Ack=14 Win=6131 Len=10

Frame 12: 64 bytes on wire (512 bits), 64 bytes captured (512 bits) on interface \Device\NPF_{F1F912BA-5843-4D7F-BEA7-0E733C5F1DA8}, id 0
Ethernet II, Src: ca:58:6a:56:25:c8 (ca:58:6a:56:25:c8), Dst: AzureWaveTec_76:92:9d (14:d4:24:76:92:9d)
Internet Protocol Version 4, Src: 192.168.0.10, Dst: 192.168.0.11
Transmission Control Protocol, Src Port: 35000, Dst Port: 64601, Seq: 40, Ack: 14, Len: 10
Data (10 bytes)

0000  41 54 50 43 0d 4f 4b 0d 0d 3e                     ATPC.OK..>

No.     Time           Source                Destination           Protocol Length Info
     13 1.183692       192.168.0.11          192.168.0.10          TCP      58     64601 → 35000 [PSH, ACK] Seq=14 Ack=50 Win=65486 Len=4

Frame 13: 58 bytes on wire (464 bits), 58 bytes captured (464 bits) on interface \Device\NPF_{F1F912BA-5843-4D7F-BEA7-0E733C5F1DA8}, id 0
Ethernet II, Src: AzureWaveTec_76:92:9d (14:d4:24:76:92:9d), Dst: ca:58:6a:56:25:c8 (ca:58:6a:56:25:c8)
Internet Protocol Version 4, Src: 192.168.0.11, Dst: 192.168.0.10
Transmission Control Protocol, Src Port: 64601, Dst Port: 35000, Seq: 14, Ack: 50, Len: 4
Data (4 bytes)

0000  41 54 49 0d                                       ATI.

No.     Time           Source                Destination           Protocol Length Info
     14 1.227096       192.168.0.10          192.168.0.11          TCP      72     35000 → 64601 [PSH, ACK] Seq=50 Ack=18 Win=6127 Len=18

Frame 14: 72 bytes on wire (576 bits), 72 bytes captured (576 bits) on interface \Device\NPF_{F1F912BA-5843-4D7F-BEA7-0E733C5F1DA8}, id 0
Ethernet II, Src: ca:58:6a:56:25:c8 (ca:58:6a:56:25:c8), Dst: AzureWaveTec_76:92:9d (14:d4:24:76:92:9d)
Internet Protocol Version 4, Src: 192.168.0.10, Dst: 192.168.0.11
Transmission Control Protocol, Src Port: 35000, Dst Port: 64601, Seq: 50, Ack: 18, Len: 18
Data (18 bytes)

0000  41 54 49 0d 20 4f 42 44 49 49 20 76 31 2e 35 0d   ATI. OBDII v1.5.
0010  0d 3e                                             .>

No.     Time           Source                Destination           Protocol Length Info
     15 1.228706       192.168.0.11          192.168.0.10          TCP      61     64601 → 35000 [PSH, ACK] Seq=18 Ack=68 Win=65468 Len=7

Frame 15: 61 bytes on wire (488 bits), 61 bytes captured (488 bits) on interface \Device\NPF_{F1F912BA-5843-4D7F-BEA7-0E733C5F1DA8}, id 0
Ethernet II, Src: AzureWaveTec_76:92:9d (14:d4:24:76:92:9d), Dst: ca:58:6a:56:25:c8 (ca:58:6a:56:25:c8)
Internet Protocol Version 4, Src: 192.168.0.11, Dst: 192.168.0.10
Transmission Control Protocol, Src Port: 64601, Dst Port: 35000, Seq: 18, Ack: 68, Len: 7
Data (7 bytes)

0000  41 54 53 50 20 30 0d                              ATSP 0.

No.     Time           Source                Destination           Protocol Length Info
     16 1.261011       192.168.0.10          192.168.0.11          TCP      66     35000 → 64601 [PSH, ACK] Seq=68 Ack=25 Win=6120 Len=12

Frame 16: 66 bytes on wire (528 bits), 66 bytes captured (528 bits) on interface \Device\NPF_{F1F912BA-5843-4D7F-BEA7-0E733C5F1DA8}, id 0
Ethernet II, Src: ca:58:6a:56:25:c8 (ca:58:6a:56:25:c8), Dst: AzureWaveTec_76:92:9d (14:d4:24:76:92:9d)
Internet Protocol Version 4, Src: 192.168.0.10, Dst: 192.168.0.11
Transmission Control Protocol, Src Port: 35000, Dst Port: 64601, Seq: 68, Ack: 25, Len: 12
Data (12 bytes)

0000  41 54 53 50 20 30 0d 4f 4b 0d 0d 3e               ATSP 0.OK..>

No.     Time           Source                Destination           Protocol Length Info
     17 1.262555       192.168.0.11          192.168.0.10          TCP      59     64601 → 35000 [PSH, ACK] Seq=25 Ack=80 Win=65456 Len=5

Frame 17: 59 bytes on wire (472 bits), 59 bytes captured (472 bits) on interface \Device\NPF_{F1F912BA-5843-4D7F-BEA7-0E733C5F1DA8}, id 0
Ethernet II, Src: AzureWaveTec_76:92:9d (14:d4:24:76:92:9d), Dst: ca:58:6a:56:25:c8 (ca:58:6a:56:25:c8)
Internet Protocol Version 4, Src: 192.168.0.11, Dst: 192.168.0.10
Transmission Control Protocol, Src Port: 64601, Dst Port: 35000, Seq: 25, Ack: 80, Len: 5
Data (5 bytes)

0000  41 54 48 31 0d                                    ATH1.

No.     Time           Source                Destination           Protocol Length Info
     18 1.290758       192.168.0.10          192.168.0.11          TCP      54     35000 → 64601 [ACK] Seq=80 Ack=30 Win=6115 Len=0

Frame 18: 54 bytes on wire (432 bits), 54 bytes captured (432 bits) on interface \Device\NPF_{F1F912BA-5843-4D7F-BEA7-0E733C5F1DA8}, id 0
Ethernet II, Src: ca:58:6a:56:25:c8 (ca:58:6a:56:25:c8), Dst: AzureWaveTec_76:92:9d (14:d4:24:76:92:9d)
Internet Protocol Version 4, Src: 192.168.0.10, Dst: 192.168.0.11
Transmission Control Protocol, Src Port: 35000, Dst Port: 64601, Seq: 80, Ack: 30, Len: 0

No.     Time           Source                Destination           Protocol Length Info
     19 1.302948       192.168.0.10          192.168.0.11          TCP      64     35000 → 64601 [PSH, ACK] Seq=80 Ack=30 Win=6115 Len=10

Frame 19: 64 bytes on wire (512 bits), 64 bytes captured (512 bits) on interface \Device\NPF_{F1F912BA-5843-4D7F-BEA7-0E733C5F1DA8}, id 0
Ethernet II, Src: ca:58:6a:56:25:c8 (ca:58:6a:56:25:c8), Dst: AzureWaveTec_76:92:9d (14:d4:24:76:92:9d)
Internet Protocol Version 4, Src: 192.168.0.10, Dst: 192.168.0.11
Transmission Control Protocol, Src Port: 35000, Dst Port: 64601, Seq: 80, Ack: 30, Len: 10
Data (10 bytes)

0000  41 54 48 31 0d 4f 4b 0d 0d 3e                     ATH1.OK..>

No.     Time           Source                Destination           Protocol Length Info
     20 1.304510       192.168.0.11          192.168.0.10          TCP      59     64601 → 35000 [PSH, ACK] Seq=30 Ack=90 Win=65446 Len=5

Frame 20: 59 bytes on wire (472 bits), 59 bytes captured (472 bits) on interface \Device\NPF_{F1F912BA-5843-4D7F-BEA7-0E733C5F1DA8}, id 0
Ethernet II, Src: AzureWaveTec_76:92:9d (14:d4:24:76:92:9d), Dst: ca:58:6a:56:25:c8 (ca:58:6a:56:25:c8)
Internet Protocol Version 4, Src: 192.168.0.11, Dst: 192.168.0.10
Transmission Control Protocol, Src Port: 64601, Dst Port: 35000, Seq: 30, Ack: 90, Len: 5
Data (5 bytes)

0000  30 31 30 30 0d                                    0100.

No.     Time           Source                Destination           Protocol Length Info
     21 1.359300       192.168.0.10          192.168.0.11          TCP      98     35000 → 64601 [PSH, ACK] Seq=90 Ack=35 Win=6110 Len=44

Frame 21: 98 bytes on wire (784 bits), 98 bytes captured (784 bits) on interface \Device\NPF_{F1F912BA-5843-4D7F-BEA7-0E733C5F1DA8}, id 0
Ethernet II, Src: ca:58:6a:56:25:c8 (ca:58:6a:56:25:c8), Dst: AzureWaveTec_76:92:9d (14:d4:24:76:92:9d)
Internet Protocol Version 4, Src: 192.168.0.10, Dst: 192.168.0.11
Transmission Control Protocol, Src Port: 35000, Dst Port: 64601, Seq: 90, Ack: 35, Len: 44
Data (44 bytes)

0000  30 31 30 30 0d 53 45 41 52 43 48 49 4e 47 2e 2e   0100.SEARCHING..
0010  2e 0d 37 45 38 20 30 36 20 34 31 20 30 30 20 39   ..7E8 06 41 00 9
0020  38 20 33 42 20 38 30 20 31 33 20 0d               8 3B 80 13 .

No.     Time           Source                Destination           Protocol Length Info
     22 1.409756       192.168.0.11          192.168.0.10          TCP      54     64601 → 35000 [ACK] Seq=35 Ack=134 Win=65402 Len=0

Frame 22: 54 bytes on wire (432 bits), 54 bytes captured (432 bits) on interface \Device\NPF_{F1F912BA-5843-4D7F-BEA7-0E733C5F1DA8}, id 0
Ethernet II, Src: AzureWaveTec_76:92:9d (14:d4:24:76:92:9d), Dst: ca:58:6a:56:25:c8 (ca:58:6a:56:25:c8)
Internet Protocol Version 4, Src: 192.168.0.11, Dst: 192.168.0.10
Transmission Control Protocol, Src Port: 64601, Dst Port: 35000, Seq: 35, Ack: 134, Len: 0

No.     Time           Source                Destination           Protocol Length Info
     23 1.558941       192.168.0.10          192.168.0.11          TCP      56     35000 → 64601 [PSH, ACK] Seq=134 Ack=35 Win=6110 Len=2

Frame 23: 56 bytes on wire (448 bits), 56 bytes captured (448 bits) on interface \Device\NPF_{F1F912BA-5843-4D7F-BEA7-0E733C5F1DA8}, id 0
Ethernet II, Src: ca:58:6a:56:25:c8 (ca:58:6a:56:25:c8), Dst: AzureWaveTec_76:92:9d (14:d4:24:76:92:9d)
Internet Protocol Version 4, Src: 192.168.0.10, Dst: 192.168.0.11
Transmission Control Protocol, Src Port: 35000, Dst Port: 64601, Seq: 134, Ack: 35, Len: 2
Data (2 bytes)

0000  0d 3e                                             .>

No.     Time           Source                Destination           Protocol Length Info
     24 1.570990       192.168.0.11          192.168.0.10          TCP      60     64601 → 35000 [PSH, ACK] Seq=35 Ack=136 Win=65400 Len=6

Frame 24: 60 bytes on wire (480 bits), 60 bytes captured (480 bits) on interface \Device\NPF_{F1F912BA-5843-4D7F-BEA7-0E733C5F1DA8}, id 0
Ethernet II, Src: AzureWaveTec_76:92:9d (14:d4:24:76:92:9d), Dst: ca:58:6a:56:25:c8 (ca:58:6a:56:25:c8)
Internet Protocol Version 4, Src: 192.168.0.11, Dst: 192.168.0.10
Transmission Control Protocol, Src Port: 64601, Dst Port: 35000, Seq: 35, Ack: 136, Len: 6
Data (6 bytes)

0000  41 54 44 50 4e 0d                                 ATDPN.

No.     Time           Source                Destination           Protocol Length Info
     25 1.603021       192.168.0.10          192.168.0.11          TCP      65     35000 → 64601 [PSH, ACK] Seq=136 Ack=41 Win=6104 Len=11

Frame 25: 65 bytes on wire (520 bits), 65 bytes captured (520 bits) on interface \Device\NPF_{F1F912BA-5843-4D7F-BEA7-0E733C5F1DA8}, id 0
Ethernet II, Src: ca:58:6a:56:25:c8 (ca:58:6a:56:25:c8), Dst: AzureWaveTec_76:92:9d (14:d4:24:76:92:9d)
Internet Protocol Version 4, Src: 192.168.0.10, Dst: 192.168.0.11
Transmission Control Protocol, Src Port: 35000, Dst Port: 64601, Seq: 136, Ack: 41, Len: 11
Data (11 bytes)

0000  41 54 44 50 4e 0d 41 36 0d 0d 3e                  ATDPN.A6..>

No.     Time           Source                Destination           Protocol Length Info
     26 1.604719       192.168.0.11          192.168.0.10          TCP      59     64601 → 35000 [PSH, ACK] Seq=41 Ack=147 Win=65389 Len=5

Frame 26: 59 bytes on wire (472 bits), 59 bytes captured (472 bits) on interface \Device\NPF_{F1F912BA-5843-4D7F-BEA7-0E733C5F1DA8}, id 0
Ethernet II, Src: AzureWaveTec_76:92:9d (14:d4:24:76:92:9d), Dst: ca:58:6a:56:25:c8 (ca:58:6a:56:25:c8)
Internet Protocol Version 4, Src: 192.168.0.11, Dst: 192.168.0.10
Transmission Control Protocol, Src Port: 64601, Dst Port: 35000, Seq: 41, Ack: 147, Len: 5
Data (5 bytes)

0000  30 31 30 30 0d                                    0100.

No.     Time           Source                Destination           Protocol Length Info
     27 1.647120       192.168.0.10          192.168.0.11          TCP      85     35000 → 64601 [PSH, ACK] Seq=147 Ack=46 Win=6099 Len=31

Frame 27: 85 bytes on wire (680 bits), 85 bytes captured (680 bits) on interface \Device\NPF_{F1F912BA-5843-4D7F-BEA7-0E733C5F1DA8}, id 0
Ethernet II, Src: ca:58:6a:56:25:c8 (ca:58:6a:56:25:c8), Dst: AzureWaveTec_76:92:9d (14:d4:24:76:92:9d)
Internet Protocol Version 4, Src: 192.168.0.10, Dst: 192.168.0.11
Transmission Control Protocol, Src Port: 35000, Dst Port: 64601, Seq: 147, Ack: 46, Len: 31
Data (31 bytes)

0000  30 31 30 30 0d 37 45 38 20 30 36 20 34 31 20 30   0100.7E8 06 41 0
0010  30 20 39 38 20 33 42 20 38 30 20 31 33 20 0d      0 98 3B 80 13 .

No.     Time           Source                Destination           Protocol Length Info
     28 1.702096       192.168.0.11          192.168.0.10          TCP      54     64601 → 35000 [ACK] Seq=46 Ack=178 Win=65358 Len=0

Frame 28: 54 bytes on wire (432 bits), 54 bytes captured (432 bits) on interface \Device\NPF_{F1F912BA-5843-4D7F-BEA7-0E733C5F1DA8}, id 0
Ethernet II, Src: AzureWaveTec_76:92:9d (14:d4:24:76:92:9d), Dst: ca:58:6a:56:25:c8 (ca:58:6a:56:25:c8)
Internet Protocol Version 4, Src: 192.168.0.11, Dst: 192.168.0.10
Transmission Control Protocol, Src Port: 64601, Dst Port: 35000, Seq: 46, Ack: 178, Len: 0

No.     Time           Source                Destination           Protocol Length Info
     29 1.844924       192.168.0.10          192.168.0.11          TCP      56     35000 → 64601 [PSH, ACK] Seq=178 Ack=46 Win=6099 Len=2

Frame 29: 56 bytes on wire (448 bits), 56 bytes captured (448 bits) on interface \Device\NPF_{F1F912BA-5843-4D7F-BEA7-0E733C5F1DA8}, id 0
Ethernet II, Src: ca:58:6a:56:25:c8 (ca:58:6a:56:25:c8), Dst: AzureWaveTec_76:92:9d (14:d4:24:76:92:9d)
Internet Protocol Version 4, Src: 192.168.0.10, Dst: 192.168.0.11
Transmission Control Protocol, Src Port: 35000, Dst Port: 64601, Seq: 178, Ack: 46, Len: 2
Data (2 bytes)

0000  0d 3e                                             .>

No.     Time           Source                Destination           Protocol Length Info
     30 1.865141       192.168.0.11          192.168.0.10          TCP      59     64601 → 35000 [PSH, ACK] Seq=46 Ack=180 Win=65356 Len=5

Frame 30: 59 bytes on wire (472 bits), 59 bytes captured (472 bits) on interface \Device\NPF_{F1F912BA-5843-4D7F-BEA7-0E733C5F1DA8}, id 0
Ethernet II, Src: AzureWaveTec_76:92:9d (14:d4:24:76:92:9d), Dst: ca:58:6a:56:25:c8 (ca:58:6a:56:25:c8)
Internet Protocol Version 4, Src: 192.168.0.11, Dst: 192.168.0.10
Transmission Control Protocol, Src Port: 64601, Dst Port: 35000, Seq: 46, Ack: 180, Len: 5
Data (5 bytes)

0000  30 31 30 30 0d                                    0100.

No.     Time           Source                Destination           Protocol Length Info
     31 1.908765       192.168.0.10          192.168.0.11          TCP      85     35000 → 64601 [PSH, ACK] Seq=180 Ack=51 Win=6094 Len=31

Frame 31: 85 bytes on wire (680 bits), 85 bytes captured (680 bits) on interface \Device\NPF_{F1F912BA-5843-4D7F-BEA7-0E733C5F1DA8}, id 0
Ethernet II, Src: ca:58:6a:56:25:c8 (ca:58:6a:56:25:c8), Dst: AzureWaveTec_76:92:9d (14:d4:24:76:92:9d)
Internet Protocol Version 4, Src: 192.168.0.10, Dst: 192.168.0.11
Transmission Control Protocol, Src Port: 35000, Dst Port: 64601, Seq: 180, Ack: 51, Len: 31
Data (31 bytes)

0000  30 31 30 30 0d 37 45 38 20 30 36 20 34 31 20 30   0100.7E8 06 41 0
0010  30 20 39 38 20 33 42 20 38 30 20 31 33 20 0d      0 98 3B 80 13 .

No.     Time           Source                Destination           Protocol Length Info
     32 1.963323       192.168.0.11          192.168.0.10          TCP      54     64601 → 35000 [ACK] Seq=51 Ack=211 Win=65325 Len=0

Frame 32: 54 bytes on wire (432 bits), 54 bytes captured (432 bits) on interface \Device\NPF_{F1F912BA-5843-4D7F-BEA7-0E733C5F1DA8}, id 0
Ethernet II, Src: AzureWaveTec_76:92:9d (14:d4:24:76:92:9d), Dst: ca:58:6a:56:25:c8 (ca:58:6a:56:25:c8)
Internet Protocol Version 4, Src: 192.168.0.11, Dst: 192.168.0.10
Transmission Control Protocol, Src Port: 64601, Dst Port: 35000, Seq: 51, Ack: 211, Len: 0

No.     Time           Source                Destination           Protocol Length Info
     33 2.108522       192.168.0.10          192.168.0.11          TCP      56     35000 → 64601 [PSH, ACK] Seq=211 Ack=51 Win=6094 Len=2

Frame 33: 56 bytes on wire (448 bits), 56 bytes captured (448 bits) on interface \Device\NPF_{F1F912BA-5843-4D7F-BEA7-0E733C5F1DA8}, id 0
Ethernet II, Src: ca:58:6a:56:25:c8 (ca:58:6a:56:25:c8), Dst: AzureWaveTec_76:92:9d (14:d4:24:76:92:9d)
Internet Protocol Version 4, Src: 192.168.0.10, Dst: 192.168.0.11
Transmission Control Protocol, Src Port: 35000, Dst Port: 64601, Seq: 211, Ack: 51, Len: 2
Data (2 bytes)

0000  0d 3e                                             .>

No.     Time           Source                Destination           Protocol Length Info
     34 2.115468       192.168.0.11          192.168.0.10          TCP      59     64601 → 35000 [PSH, ACK] Seq=51 Ack=213 Win=65323 Len=5

Frame 34: 59 bytes on wire (472 bits), 59 bytes captured (472 bits) on interface \Device\NPF_{F1F912BA-5843-4D7F-BEA7-0E733C5F1DA8}, id 0
Ethernet II, Src: AzureWaveTec_76:92:9d (14:d4:24:76:92:9d), Dst: ca:58:6a:56:25:c8 (ca:58:6a:56:25:c8)
Internet Protocol Version 4, Src: 192.168.0.11, Dst: 192.168.0.10
Transmission Control Protocol, Src Port: 64601, Dst Port: 35000, Seq: 51, Ack: 213, Len: 5
Data (5 bytes)

0000  30 31 32 30 0d                                    0120.

No.     Time           Source                Destination           Protocol Length Info
     35 2.162030       192.168.0.10          192.168.0.11          TCP      85     35000 → 64601 [PSH, ACK] Seq=213 Ack=56 Win=6089 Len=31

Frame 35: 85 bytes on wire (680 bits), 85 bytes captured (680 bits) on interface \Device\NPF_{F1F912BA-5843-4D7F-BEA7-0E733C5F1DA8}, id 0
Ethernet II, Src: ca:58:6a:56:25:c8 (ca:58:6a:56:25:c8), Dst: AzureWaveTec_76:92:9d (14:d4:24:76:92:9d)
Internet Protocol Version 4, Src: 192.168.0.10, Dst: 192.168.0.11
Transmission Control Protocol, Src Port: 35000, Dst Port: 64601, Seq: 213, Ack: 56, Len: 31
Data (31 bytes)

0000  30 31 32 30 0d 37 45 38 20 30 36 20 34 31 20 32   0120.7E8 06 41 2
0010  30 20 39 30 20 30 31 20 42 30 20 30 31 20 0d      0 90 01 B0 01 .

No.     Time           Source                Destination           Protocol Length Info
     36 2.209004       192.168.0.11          192.168.0.10          TCP      54     64601 → 35000 [ACK] Seq=56 Ack=244 Win=65292 Len=0

Frame 36: 54 bytes on wire (432 bits), 54 bytes captured (432 bits) on interface \Device\NPF_{F1F912BA-5843-4D7F-BEA7-0E733C5F1DA8}, id 0
Ethernet II, Src: AzureWaveTec_76:92:9d (14:d4:24:76:92:9d), Dst: ca:58:6a:56:25:c8 (ca:58:6a:56:25:c8)
Internet Protocol Version 4, Src: 192.168.0.11, Dst: 192.168.0.10
Transmission Control Protocol, Src Port: 64601, Dst Port: 35000, Seq: 56, Ack: 244, Len: 0

No.     Time           Source                Destination           Protocol Length Info
     37 2.356729       192.168.0.10          192.168.0.11          TCP      56     35000 → 64601 [PSH, ACK] Seq=244 Ack=56 Win=6089 Len=2

Frame 37: 56 bytes on wire (448 bits), 56 bytes captured (448 bits) on interface \Device\NPF_{F1F912BA-5843-4D7F-BEA7-0E733C5F1DA8}, id 0
Ethernet II, Src: ca:58:6a:56:25:c8 (ca:58:6a:56:25:c8), Dst: AzureWaveTec_76:92:9d (14:d4:24:76:92:9d)
Internet Protocol Version 4, Src: 192.168.0.10, Dst: 192.168.0.11
Transmission Control Protocol, Src Port: 35000, Dst Port: 64601, Seq: 244, Ack: 56, Len: 2
Data (2 bytes)

0000  0d 3e                                             .>

No.     Time           Source                Destination           Protocol Length Info
     38 2.359824       192.168.0.11          192.168.0.10          TCP      59     64601 → 35000 [PSH, ACK] Seq=56 Ack=246 Win=65290 Len=5

Frame 38: 59 bytes on wire (472 bits), 59 bytes captured (472 bits) on interface \Device\NPF_{F1F912BA-5843-4D7F-BEA7-0E733C5F1DA8}, id 0
Ethernet II, Src: AzureWaveTec_76:92:9d (14:d4:24:76:92:9d), Dst: ca:58:6a:56:25:c8 (ca:58:6a:56:25:c8)
Internet Protocol Version 4, Src: 192.168.0.11, Dst: 192.168.0.10
Transmission Control Protocol, Src Port: 64601, Dst Port: 35000, Seq: 56, Ack: 246, Len: 5
Data (5 bytes)

0000  30 31 34 30 0d                                    0140.

No.     Time           Source                Destination           Protocol Length Info
     39 2.403187       192.168.0.10          192.168.0.11          TCP      85     35000 → 64601 [PSH, ACK] Seq=246 Ack=61 Win=6084 Len=31

Frame 39: 85 bytes on wire (680 bits), 85 bytes captured (680 bits) on interface \Device\NPF_{F1F912BA-5843-4D7F-BEA7-0E733C5F1DA8}, id 0
Ethernet II, Src: ca:58:6a:56:25:c8 (ca:58:6a:56:25:c8), Dst: AzureWaveTec_76:92:9d (14:d4:24:76:92:9d)
Internet Protocol Version 4, Src: 192.168.0.10, Dst: 192.168.0.11
Transmission Control Protocol, Src Port: 35000, Dst Port: 64601, Seq: 246, Ack: 61, Len: 31
Data (31 bytes)

0000  30 31 34 30 0d 37 45 38 20 30 36 20 34 31 20 34   0140.7E8 06 41 4
0010  30 20 34 30 20 44 45 20 30 30 20 30 39 20 0d      0 40 DE 00 09 .

No.     Time           Source                Destination           Protocol Length Info
     40 2.456418       192.168.0.11          192.168.0.10          TCP      54     64601 → 35000 [ACK] Seq=61 Ack=277 Win=65259 Len=0

Frame 40: 54 bytes on wire (432 bits), 54 bytes captured (432 bits) on interface \Device\NPF_{F1F912BA-5843-4D7F-BEA7-0E733C5F1DA8}, id 0
Ethernet II, Src: AzureWaveTec_76:92:9d (14:d4:24:76:92:9d), Dst: ca:58:6a:56:25:c8 (ca:58:6a:56:25:c8)
Internet Protocol Version 4, Src: 192.168.0.11, Dst: 192.168.0.10
Transmission Control Protocol, Src Port: 64601, Dst Port: 35000, Seq: 61, Ack: 277, Len: 0

No.     Time           Source                Destination           Protocol Length Info
     41 2.602053       192.168.0.10          192.168.0.11          TCP      56     35000 → 64601 [PSH, ACK] Seq=277 Ack=61 Win=6084 Len=2

Frame 41: 56 bytes on wire (448 bits), 56 bytes captured (448 bits) on interface \Device\NPF_{F1F912BA-5843-4D7F-BEA7-0E733C5F1DA8}, id 0
Ethernet II, Src: ca:58:6a:56:25:c8 (ca:58:6a:56:25:c8), Dst: AzureWaveTec_76:92:9d (14:d4:24:76:92:9d)
Internet Protocol Version 4, Src: 192.168.0.10, Dst: 192.168.0.11
Transmission Control Protocol, Src Port: 35000, Dst Port: 64601, Seq: 277, Ack: 61, Len: 2
Data (2 bytes)

0000  0d 3e                                             .>

No.     Time           Source                Destination           Protocol Length Info
     42 2.604780       192.168.0.11          192.168.0.10          TCP      59     64601 → 35000 [PSH, ACK] Seq=61 Ack=279 Win=65257 Len=5

Frame 42: 59 bytes on wire (472 bits), 59 bytes captured (472 bits) on interface \Device\NPF_{F1F912BA-5843-4D7F-BEA7-0E733C5F1DA8}, id 0
Ethernet II, Src: AzureWaveTec_76:92:9d (14:d4:24:76:92:9d), Dst: ca:58:6a:56:25:c8 (ca:58:6a:56:25:c8)
Internet Protocol Version 4, Src: 192.168.0.11, Dst: 192.168.0.10
Transmission Control Protocol, Src Port: 64601, Dst Port: 35000, Seq: 61, Ack: 279, Len: 5
Data (5 bytes)

0000  30 31 36 30 0d                                    0160.

No.     Time           Source                Destination           Protocol Length Info
     43 2.649179       192.168.0.10          192.168.0.11          TCP      85     35000 → 64601 [PSH, ACK] Seq=279 Ack=66 Win=6079 Len=31

Frame 43: 85 bytes on wire (680 bits), 85 bytes captured (680 bits) on interface \Device\NPF_{F1F912BA-5843-4D7F-BEA7-0E733C5F1DA8}, id 0
Ethernet II, Src: ca:58:6a:56:25:c8 (ca:58:6a:56:25:c8), Dst: AzureWaveTec_76:92:9d (14:d4:24:76:92:9d)
Internet Protocol Version 4, Src: 192.168.0.10, Dst: 192.168.0.11
Transmission Control Protocol, Src Port: 35000, Dst Port: 64601, Seq: 279, Ack: 66, Len: 31
Data (31 bytes)

0000  30 31 36 30 0d 37 45 38 20 30 36 20 34 31 20 36   0160.7E8 06 41 6
0010  30 20 30 38 20 43 39 20 38 33 20 34 30 20 0d      0 08 C9 83 40 .

No.     Time           Source                Destination           Protocol Length Info
     44 2.703590       192.168.0.11          192.168.0.10          TCP      54     64601 → 35000 [ACK] Seq=66 Ack=310 Win=65226 Len=0

Frame 44: 54 bytes on wire (432 bits), 54 bytes captured (432 bits) on interface \Device\NPF_{F1F912BA-5843-4D7F-BEA7-0E733C5F1DA8}, id 0
Ethernet II, Src: AzureWaveTec_76:92:9d (14:d4:24:76:92:9d), Dst: ca:58:6a:56:25:c8 (ca:58:6a:56:25:c8)
Internet Protocol Version 4, Src: 192.168.0.11, Dst: 192.168.0.10
Transmission Control Protocol, Src Port: 64601, Dst Port: 35000, Seq: 66, Ack: 310, Len: 0

No.     Time           Source                Destination           Protocol Length Info
     45 2.717688       192.168.0.10          192.168.0.11          TCP      56     35000 → 64601 [PSH, ACK] Seq=310 Ack=66 Win=6079 Len=2

Frame 45: 56 bytes on wire (448 bits), 56 bytes captured (448 bits) on interface \Device\NPF_{F1F912BA-5843-4D7F-BEA7-0E733C5F1DA8}, id 0
Ethernet II, Src: ca:58:6a:56:25:c8 (ca:58:6a:56:25:c8), Dst: AzureWaveTec_76:92:9d (14:d4:24:76:92:9d)
Internet Protocol Version 4, Src: 192.168.0.10, Dst: 192.168.0.11
Transmission Control Protocol, Src Port: 35000, Dst Port: 64601, Seq: 310, Ack: 66, Len: 2
Data (2 bytes)

0000  0d 3e                                             .>

No.     Time           Source                Destination           Protocol Length Info
     46 2.721565       192.168.0.11          192.168.0.10          TCP      59     64601 → 35000 [PSH, ACK] Seq=66 Ack=312 Win=65224 Len=5

Frame 46: 59 bytes on wire (472 bits), 59 bytes captured (472 bits) on interface \Device\NPF_{F1F912BA-5843-4D7F-BEA7-0E733C5F1DA8}, id 0
Ethernet II, Src: AzureWaveTec_76:92:9d (14:d4:24:76:92:9d), Dst: ca:58:6a:56:25:c8 (ca:58:6a:56:25:c8)
Internet Protocol Version 4, Src: 192.168.0.11, Dst: 192.168.0.10
Transmission Control Protocol, Src Port: 64601, Dst Port: 35000, Seq: 66, Ack: 312, Len: 5
Data (5 bytes)

0000  30 39 30 30 0d                                    0900.

No.     Time           Source                Destination           Protocol Length Info
     47 2.765113       192.168.0.10          192.168.0.11          TCP      85     35000 → 64601 [PSH, ACK] Seq=312 Ack=71 Win=6074 Len=31

Frame 47: 85 bytes on wire (680 bits), 85 bytes captured (680 bits) on interface \Device\NPF_{F1F912BA-5843-4D7F-BEA7-0E733C5F1DA8}, id 0
Ethernet II, Src: ca:58:6a:56:25:c8 (ca:58:6a:56:25:c8), Dst: AzureWaveTec_76:92:9d (14:d4:24:76:92:9d)
Internet Protocol Version 4, Src: 192.168.0.10, Dst: 192.168.0.11
Transmission Control Protocol, Src Port: 35000, Dst Port: 64601, Seq: 312, Ack: 71, Len: 31
Data (31 bytes)

0000  30 39 30 30 0d 37 45 38 20 30 36 20 34 39 20 30   0900.7E8 06 49 0
0010  30 20 35 34 20 36 30 20 30 30 20 30 30 20 0d      0 54 60 00 00 .

No.     Time           Source                Destination           Protocol Length Info
     48 2.811865       192.168.0.11          192.168.0.10          TCP      54     64601 → 35000 [ACK] Seq=71 Ack=343 Win=65193 Len=0

Frame 48: 54 bytes on wire (432 bits), 54 bytes captured (432 bits) on interface \Device\NPF_{F1F912BA-5843-4D7F-BEA7-0E733C5F1DA8}, id 0
Ethernet II, Src: AzureWaveTec_76:92:9d (14:d4:24:76:92:9d), Dst: ca:58:6a:56:25:c8 (ca:58:6a:56:25:c8)
Internet Protocol Version 4, Src: 192.168.0.11, Dst: 192.168.0.10
Transmission Control Protocol, Src Port: 64601, Dst Port: 35000, Seq: 71, Ack: 343, Len: 0

No.     Time           Source                Destination           Protocol Length Info
     49 2.822782       192.168.0.10          192.168.0.11          TCP      56     35000 → 64601 [PSH, ACK] Seq=343 Ack=71 Win=6074 Len=2

Frame 49: 56 bytes on wire (448 bits), 56 bytes captured (448 bits) on interface \Device\NPF_{F1F912BA-5843-4D7F-BEA7-0E733C5F1DA8}, id 0
Ethernet II, Src: ca:58:6a:56:25:c8 (ca:58:6a:56:25:c8), Dst: AzureWaveTec_76:92:9d (14:d4:24:76:92:9d)
Internet Protocol Version 4, Src: 192.168.0.10, Dst: 192.168.0.11
Transmission Control Protocol, Src Port: 35000, Dst Port: 64601, Seq: 343, Ack: 71, Len: 2
Data (2 bytes)

0000  0d 3e                                             .>

No.     Time           Source                Destination           Protocol Length Info
     50 2.828222       192.168.0.11          192.168.0.10          TCP      59     64601 → 35000 [PSH, ACK] Seq=71 Ack=345 Win=65191 Len=5

Frame 50: 59 bytes on wire (472 bits), 59 bytes captured (472 bits) on interface \Device\NPF_{F1F912BA-5843-4D7F-BEA7-0E733C5F1DA8}, id 0
Ethernet II, Src: AzureWaveTec_76:92:9d (14:d4:24:76:92:9d), Dst: ca:58:6a:56:25:c8 (ca:58:6a:56:25:c8)
Internet Protocol Version 4, Src: 192.168.0.11, Dst: 192.168.0.10
Transmission Control Protocol, Src Port: 64601, Dst Port: 35000, Seq: 71, Ack: 345, Len: 5
Data (5 bytes)

0000  30 39 30 32 0d                                    0902.

No.     Time           Source                Destination           Protocol Length Info
     51 2.864783       192.168.0.10          192.168.0.11          TCP      118    35000 → 64601 [PSH, ACK] Seq=345 Ack=76 Win=6069 Len=64

Frame 51: 118 bytes on wire (944 bits), 118 bytes captured (944 bits) on interface \Device\NPF_{F1F912BA-5843-4D7F-BEA7-0E733C5F1DA8}, id 0
Ethernet II, Src: ca:58:6a:56:25:c8 (ca:58:6a:56:25:c8), Dst: AzureWaveTec_76:92:9d (14:d4:24:76:92:9d)
Internet Protocol Version 4, Src: 192.168.0.10, Dst: 192.168.0.11
Transmission Control Protocol, Src Port: 35000, Dst Port: 64601, Seq: 345, Ack: 76, Len: 64
Data (64 bytes)

0000  30 39 30 32 0d 37 45 38 20 31 30 20 31 34 20 34   0902.7E8 10 14 4
0010  39 20 30 32 20 30 31 20 34 44 20 35 32 20 33 30   9 02 01 4D 52 30
0020  20 0d 37 45 38 20 32 31 20 34 36 20 34 32 20 33    .7E8 21 46 42 3
0030  38 20 34 33 20 34 34 20 33 33 20 34 38 20 0d 37   8 43 44 33 48 .7

No.     Time           Source                Destination           Protocol Length Info
     52 2.920211       192.168.0.11          192.168.0.10          TCP      54     64601 → 35000 [ACK] Seq=76 Ack=409 Win=65127 Len=0

Frame 52: 54 bytes on wire (432 bits), 54 bytes captured (432 bits) on interface \Device\NPF_{F1F912BA-5843-4D7F-BEA7-0E733C5F1DA8}, id 0
Ethernet II, Src: AzureWaveTec_76:92:9d (14:d4:24:76:92:9d), Dst: ca:58:6a:56:25:c8 (ca:58:6a:56:25:c8)
Internet Protocol Version 4, Src: 192.168.0.11, Dst: 192.168.0.10
Transmission Control Protocol, Src Port: 64601, Dst Port: 35000, Seq: 76, Ack: 409, Len: 0

No.     Time           Source                Destination           Protocol Length Info
     53 2.927741       192.168.0.10          192.168.0.11          TCP      82     35000 → 64601 [PSH, ACK] Seq=409 Ack=76 Win=6069 Len=28

Frame 53: 82 bytes on wire (656 bits), 82 bytes captured (656 bits) on interface \Device\NPF_{F1F912BA-5843-4D7F-BEA7-0E733C5F1DA8}, id 0
Ethernet II, Src: ca:58:6a:56:25:c8 (ca:58:6a:56:25:c8), Dst: AzureWaveTec_76:92:9d (14:d4:24:76:92:9d)
Internet Protocol Version 4, Src: 192.168.0.10, Dst: 192.168.0.11
Transmission Control Protocol, Src Port: 35000, Dst Port: 64601, Seq: 409, Ack: 76, Len: 28
Data (28 bytes)

0000  45 38 20 32 32 20 33 30 20 33 33 20 33 32 20 33   E8 22 30 33 32 3
0010  30 20 33 38 20 33 30 20 33 32 20 0d               0 38 30 32 .

No.     Time           Source                Destination           Protocol Length Info
     54 2.981222       192.168.0.11          192.168.0.10          TCP      54     64601 → 35000 [ACK] Seq=76 Ack=437 Win=65099 Len=0

Frame 54: 54 bytes on wire (432 bits), 54 bytes captured (432 bits) on interface \Device\NPF_{F1F912BA-5843-4D7F-BEA7-0E733C5F1DA8}, id 0
Ethernet II, Src: AzureWaveTec_76:92:9d (14:d4:24:76:92:9d), Dst: ca:58:6a:56:25:c8 (ca:58:6a:56:25:c8)
Internet Protocol Version 4, Src: 192.168.0.11, Dst: 192.168.0.10
Transmission Control Protocol, Src Port: 64601, Dst Port: 35000, Seq: 76, Ack: 437, Len: 0

No.     Time           Source                Destination           Protocol Length Info
     55 2.984165       192.168.0.10          192.168.0.11          TCP      56     35000 → 64601 [PSH, ACK] Seq=437 Ack=76 Win=6069 Len=2

Frame 55: 56 bytes on wire (448 bits), 56 bytes captured (448 bits) on interface \Device\NPF_{F1F912BA-5843-4D7F-BEA7-0E733C5F1DA8}, id 0
Ethernet II, Src: ca:58:6a:56:25:c8 (ca:58:6a:56:25:c8), Dst: AzureWaveTec_76:92:9d (14:d4:24:76:92:9d)
Internet Protocol Version 4, Src: 192.168.0.10, Dst: 192.168.0.11
Transmission Control Protocol, Src Port: 35000, Dst Port: 64601, Seq: 437, Ack: 76, Len: 2
Data (2 bytes)

0000  0d 3e                                             .>

No.     Time           Source                Destination           Protocol Length Info
     56 2.988622       192.168.0.11          192.168.0.10          TCP      59     64601 → 35000 [PSH, ACK] Seq=76 Ack=439 Win=65097 Len=5

Frame 56: 59 bytes on wire (472 bits), 59 bytes captured (472 bits) on interface \Device\NPF_{F1F912BA-5843-4D7F-BEA7-0E733C5F1DA8}, id 0
Ethernet II, Src: AzureWaveTec_76:92:9d (14:d4:24:76:92:9d), Dst: ca:58:6a:56:25:c8 (ca:58:6a:56:25:c8)
Internet Protocol Version 4, Src: 192.168.0.11, Dst: 192.168.0.10
Transmission Control Protocol, Src Port: 64601, Dst Port: 35000, Seq: 76, Ack: 439, Len: 5
Data (5 bytes)

0000  30 39 30 34 0d                                    0904.

No.     Time           Source                Destination           Protocol Length Info
     57 3.020621       192.168.0.10          192.168.0.11          TCP      118    35000 → 64601 [PSH, ACK] Seq=439 Ack=81 Win=6064 Len=64

Frame 57: 118 bytes on wire (944 bits), 118 bytes captured (944 bits) on interface \Device\NPF_{F1F912BA-5843-4D7F-BEA7-0E733C5F1DA8}, id 0
Ethernet II, Src: ca:58:6a:56:25:c8 (ca:58:6a:56:25:c8), Dst: AzureWaveTec_76:92:9d (14:d4:24:76:92:9d)
Internet Protocol Version 4, Src: 192.168.0.10, Dst: 192.168.0.11
Transmission Control Protocol, Src Port: 35000, Dst Port: 64601, Seq: 439, Ack: 81, Len: 64
