No.     Time           Source                Destination           Protocol Length Info
      1 0.000000       192.168.0.11          192.168.0.10          DNS      76     Standard query 0x2118 A dns.msftncsi.com

Frame 1: 76 bytes on wire (608 bits), 76 bytes captured (608 bits) on interface \Device\NPF_{F1F912BA-5843-4D7F-BEA7-0E733C5F1DA8}, id 0
Ethernet II, Src: AzureWaveTec_76:92:9d (14:d4:24:76:92:9d), Dst: ca:58:6a:56:25:c8 (ca:58:6a:56:25:c8)
Internet Protocol Version 4, Src: 192.168.0.11, Dst: 192.168.0.10
User Datagram Protocol, Src Port: 65208, Dst Port: 53
Domain Name System (query)

No.     Time           Source                Destination           Protocol Length Info
      2 0.016644       192.168.0.10          192.168.0.11          DNS      76     Standard query response 0x2118 No such name A dns.msftncsi.com

Frame 2: 76 bytes on wire (608 bits), 76 bytes captured (608 bits) on interface \Device\NPF_{F1F912BA-5843-4D7F-BEA7-0E733C5F1DA8}, id 0
Ethernet II, Src: ca:58:6a:56:25:c8 (ca:58:6a:56:25:c8), Dst: AzureWaveTec_76:92:9d (14:d4:24:76:92:9d)
Internet Protocol Version 4, Src: 192.168.0.10, Dst: 192.168.0.11
User Datagram Protocol, Src Port: 53, Dst Port: 65208
Domain Name System (response)

No.     Time           Source                Destination           Protocol Length Info
      3 0.017146       192.168.0.11          192.168.0.10          DNS      76     Standard query 0x6f8d AAAA dns.msftncsi.com

Frame 3: 76 bytes on wire (608 bits), 76 bytes captured (608 bits) on interface \Device\NPF_{F1F912BA-5843-4D7F-BEA7-0E733C5F1DA8}, id 0
Ethernet II, Src: AzureWaveTec_76:92:9d (14:d4:24:76:92:9d), Dst: ca:58:6a:56:25:c8 (ca:58:6a:56:25:c8)
Internet Protocol Version 4, Src: 192.168.0.11, Dst: 192.168.0.10
User Datagram Protocol, Src Port: 65208, Dst Port: 53
Domain Name System (query)

No.     Time           Source                Destination           Protocol Length Info
      4 0.019917       192.168.0.10          192.168.0.11          DNS      76     Standard query response 0x6f8d No such name AAAA dns.msftncsi.com

Frame 4: 76 bytes on wire (608 bits), 76 bytes captured (608 bits) on interface \Device\NPF_{F1F912BA-5843-4D7F-BEA7-0E733C5F1DA8}, id 0
Ethernet II, Src: ca:58:6a:56:25:c8 (ca:58:6a:56:25:c8), Dst: AzureWaveTec_76:92:9d (14:d4:24:76:92:9d)
Internet Protocol Version 4, Src: 192.168.0.10, Dst: 192.168.0.11
User Datagram Protocol, Src Port: 53, Dst Port: 65208
Domain Name System (response)

No.     Time           Source                Destination           Protocol Length Info
      5 13.644999      192.168.0.11          192.168.0.10          DNS      76     Standard query 0xdd87 A dns.msftncsi.com

Frame 5: 76 bytes on wire (608 bits), 76 bytes captured (608 bits) on interface \Device\NPF_{F1F912BA-5843-4D7F-BEA7-0E733C5F1DA8}, id 0
Ethernet II, Src: AzureWaveTec_76:92:9d (14:d4:24:76:92:9d), Dst: ca:58:6a:56:25:c8 (ca:58:6a:56:25:c8)
Internet Protocol Version 4, Src: 192.168.0.11, Dst: 192.168.0.10
User Datagram Protocol, Src Port: 65208, Dst Port: 53
Domain Name System (query)

No.     Time           Source                Destination           Protocol Length Info
      6 13.647503      192.168.0.11          23.195.99.205         TCP      66     60424 → 80 [SYN] Seq=0 Win=65535 Len=0 MSS=1460 WS=256 SACK_PERM

Frame 6: 66 bytes on wire (528 bits), 66 bytes captured (528 bits) on interface \Device\NPF_{F1F912BA-5843-4D7F-BEA7-0E733C5F1DA8}, id 0
Ethernet II, Src: AzureWaveTec_76:92:9d (14:d4:24:76:92:9d), Dst: ca:58:6a:56:25:c8 (ca:58:6a:56:25:c8)
Internet Protocol Version 4, Src: 192.168.0.11, Dst: 23.195.99.205
Transmission Control Protocol, Src Port: 60424, Dst Port: 80, Seq: 0, Len: 0

No.     Time           Source                Destination           Protocol Length Info
      7 13.648173      192.168.0.11          23.195.99.205         TCP      66     60425 → 80 [SYN] Seq=0 Win=65535 Len=0 MSS=1460 WS=256 SACK_PERM

Frame 7: 66 bytes on wire (528 bits), 66 bytes captured (528 bits) on interface \Device\NPF_{F1F912BA-5843-4D7F-BEA7-0E733C5F1DA8}, id 0
Ethernet II, Src: AzureWaveTec_76:92:9d (14:d4:24:76:92:9d), Dst: ca:58:6a:56:25:c8 (ca:58:6a:56:25:c8)
Internet Protocol Version 4, Src: 192.168.0.11, Dst: 23.195.99.205
Transmission Control Protocol, Src Port: 60425, Dst Port: 80, Seq: 0, Len: 0

No.     Time           Source                Destination           Protocol Length Info
      8 13.650667      192.168.0.10          192.168.0.11          DNS      76     Standard query response 0xdd87 No such name A dns.msftncsi.com

Frame 8: 76 bytes on wire (608 bits), 76 bytes captured (608 bits) on interface \Device\NPF_{F1F912BA-5843-4D7F-BEA7-0E733C5F1DA8}, id 0
Ethernet II, Src: ca:58:6a:56:25:c8 (ca:58:6a:56:25:c8), Dst: AzureWaveTec_76:92:9d (14:d4:24:76:92:9d)
Internet Protocol Version 4, Src: 192.168.0.10, Dst: 192.168.0.11
User Datagram Protocol, Src Port: 53, Dst Port: 65208
Domain Name System (response)

No.     Time           Source                Destination           Protocol Length Info
      9 13.651297      192.168.0.11          192.168.0.10          TCP      66     51905 → 53 [SYN] Seq=0 Win=65535 Len=0 MSS=1460 WS=256 SACK_PERM

Frame 9: 66 bytes on wire (528 bits), 66 bytes captured (528 bits) on interface \Device\NPF_{F1F912BA-5843-4D7F-BEA7-0E733C5F1DA8}, id 0
Ethernet II, Src: AzureWaveTec_76:92:9d (14:d4:24:76:92:9d), Dst: ca:58:6a:56:25:c8 (ca:58:6a:56:25:c8)
Internet Protocol Version 4, Src: 192.168.0.11, Dst: 192.168.0.10
Transmission Control Protocol, Src Port: 51905, Dst Port: 53, Seq: 0, Len: 0

No.     Time           Source                Destination           Protocol Length Info
     10 13.654056      192.168.0.10          192.168.0.11          TCP      54     53 → 51905 [RST, ACK] Seq=1 Ack=1 Win=6144 Len=0

Frame 10: 54 bytes on wire (432 bits), 54 bytes captured (432 bits) on interface \Device\NPF_{F1F912BA-5843-4D7F-BEA7-0E733C5F1DA8}, id 0
Ethernet II, Src: ca:58:6a:56:25:c8 (ca:58:6a:56:25:c8), Dst: AzureWaveTec_76:92:9d (14:d4:24:76:92:9d)
Internet Protocol Version 4, Src: 192.168.0.10, Dst: 192.168.0.11
Transmission Control Protocol, Src Port: 53, Dst Port: 51905, Seq: 1, Ack: 1, Len: 0

No.     Time           Source                Destination           Protocol Length Info
     11 14.165788      192.168.0.11          192.168.0.10          TCP      66     [TCP Port numbers reused] 51905 → 53 [SYN] Seq=0 Win=65535 Len=0 MSS=1460 WS=256 SACK_PERM

Frame 11: 66 bytes on wire (528 bits), 66 bytes captured (528 bits) on interface \Device\NPF_{F1F912BA-5843-4D7F-BEA7-0E733C5F1DA8}, id 0
Ethernet II, Src: AzureWaveTec_76:92:9d (14:d4:24:76:92:9d), Dst: ca:58:6a:56:25:c8 (ca:58:6a:56:25:c8)
Internet Protocol Version 4, Src: 192.168.0.11, Dst: 192.168.0.10
Transmission Control Protocol, Src Port: 51905, Dst Port: 53, Seq: 0, Len: 0

No.     Time           Source                Destination           Protocol Length Info
     12 14.168659      192.168.0.10          192.168.0.11          TCP      54     53 → 51905 [RST, ACK] Seq=1 Ack=1 Win=6144 Len=0

Frame 12: 54 bytes on wire (432 bits), 54 bytes captured (432 bits) on interface \Device\NPF_{F1F912BA-5843-4D7F-BEA7-0E733C5F1DA8}, id 0
Ethernet II, Src: ca:58:6a:56:25:c8 (ca:58:6a:56:25:c8), Dst: AzureWaveTec_76:92:9d (14:d4:24:76:92:9d)
Internet Protocol Version 4, Src: 192.168.0.10, Dst: 192.168.0.11
Transmission Control Protocol, Src Port: 53, Dst Port: 51905, Seq: 1, Ack: 1, Len: 0

No.     Time           Source                Destination           Protocol Length Info
     13 14.429571      192.168.0.11          192.168.0.10          DNS      111    Standard query 0xbe7a A obdaiazurefunctions20240928071526.azurewebsites.net

Frame 13: 111 bytes on wire (888 bits), 111 bytes captured (888 bits) on interface \Device\NPF_{F1F912BA-5843-4D7F-BEA7-0E733C5F1DA8}, id 0
Ethernet II, Src: AzureWaveTec_76:92:9d (14:d4:24:76:92:9d), Dst: ca:58:6a:56:25:c8 (ca:58:6a:56:25:c8)
Internet Protocol Version 4, Src: 192.168.0.11, Dst: 192.168.0.10
User Datagram Protocol, Src Port: 62589, Dst Port: 53
Domain Name System (query)

No.     Time           Source                Destination           Protocol Length Info
     14 14.437550      192.168.0.10          192.168.0.11          DNS      111    Standard query response 0xbe7a No such name A obdaiazurefunctions20240928071526.azurewebsites.net

Frame 14: 111 bytes on wire (888 bits), 111 bytes captured (888 bits) on interface \Device\NPF_{F1F912BA-5843-4D7F-BEA7-0E733C5F1DA8}, id 0
Ethernet II, Src: ca:58:6a:56:25:c8 (ca:58:6a:56:25:c8), Dst: AzureWaveTec_76:92:9d (14:d4:24:76:92:9d)
Internet Protocol Version 4, Src: 192.168.0.10, Dst: 192.168.0.11
User Datagram Protocol, Src Port: 53, Dst Port: 62589
Domain Name System (response)

No.     Time           Source                Destination           Protocol Length Info
     15 14.648249      192.168.0.11          23.195.99.205         TCP      66     [TCP Retransmission] 60424 → 80 [SYN] Seq=0 Win=65535 Len=0 MSS=1460 WS=256 SACK_PERM

Frame 15: 66 bytes on wire (528 bits), 66 bytes captured (528 bits) on interface \Device\NPF_{F1F912BA-5843-4D7F-BEA7-0E733C5F1DA8}, id 0
Ethernet II, Src: AzureWaveTec_76:92:9d (14:d4:24:76:92:9d), Dst: ca:58:6a:56:25:c8 (ca:58:6a:56:25:c8)
Internet Protocol Version 4, Src: 192.168.0.11, Dst: 23.195.99.205
Transmission Control Protocol, Src Port: 60424, Dst Port: 80, Seq: 0, Len: 0

No.     Time           Source                Destination           Protocol Length Info
     16 14.648342      192.168.0.11          23.195.99.205         TCP      66     [TCP Retransmission] 60425 → 80 [SYN] Seq=0 Win=65535 Len=0 MSS=1460 WS=256 SACK_PERM

Frame 16: 66 bytes on wire (528 bits), 66 bytes captured (528 bits) on interface \Device\NPF_{F1F912BA-5843-4D7F-BEA7-0E733C5F1DA8}, id 0
Ethernet II, Src: AzureWaveTec_76:92:9d (14:d4:24:76:92:9d), Dst: ca:58:6a:56:25:c8 (ca:58:6a:56:25:c8)
Internet Protocol Version 4, Src: 192.168.0.11, Dst: 23.195.99.205
Transmission Control Protocol, Src Port: 60425, Dst Port: 80, Seq: 0, Len: 0

No.     Time           Source                Destination           Protocol Length Info
     17 14.678762      192.168.0.11          192.168.0.10          TCP      66     [TCP Port numbers reused] 51905 → 53 [SYN] Seq=0 Win=65535 Len=0 MSS=1460 WS=256 SACK_PERM

Frame 17: 66 bytes on wire (528 bits), 66 bytes captured (528 bits) on interface \Device\NPF_{F1F912BA-5843-4D7F-BEA7-0E733C5F1DA8}, id 0
Ethernet II, Src: AzureWaveTec_76:92:9d (14:d4:24:76:92:9d), Dst: ca:58:6a:56:25:c8 (ca:58:6a:56:25:c8)
Internet Protocol Version 4, Src: 192.168.0.11, Dst: 192.168.0.10
Transmission Control Protocol, Src Port: 51905, Dst Port: 53, Seq: 0, Len: 0

No.     Time           Source                Destination           Protocol Length Info
     18 14.682461      192.168.0.10          192.168.0.11          TCP      54     53 → 51905 [RST, ACK] Seq=1 Ack=1 Win=6144 Len=0

Frame 18: 54 bytes on wire (432 bits), 54 bytes captured (432 bits) on interface \Device\NPF_{F1F912BA-5843-4D7F-BEA7-0E733C5F1DA8}, id 0
Ethernet II, Src: ca:58:6a:56:25:c8 (ca:58:6a:56:25:c8), Dst: AzureWaveTec_76:92:9d (14:d4:24:76:92:9d)
Internet Protocol Version 4, Src: 192.168.0.10, Dst: 192.168.0.11
Transmission Control Protocol, Src Port: 53, Dst Port: 51905, Seq: 1, Ack: 1, Len: 0

No.     Time           Source                Destination           Protocol Length Info
     19 15.190833      192.168.0.11          192.168.0.10          TCP      66     [TCP Port numbers reused] 51905 → 53 [SYN] Seq=0 Win=65535 Len=0 MSS=1460 WS=256 SACK_PERM

Frame 19: 66 bytes on wire (528 bits), 66 bytes captured (528 bits) on interface \Device\NPF_{F1F912BA-5843-4D7F-BEA7-0E733C5F1DA8}, id 0
Ethernet II, Src: AzureWaveTec_76:92:9d (14:d4:24:76:92:9d), Dst: ca:58:6a:56:25:c8 (ca:58:6a:56:25:c8)
Internet Protocol Version 4, Src: 192.168.0.11, Dst: 192.168.0.10
Transmission Control Protocol, Src Port: 51905, Dst Port: 53, Seq: 0, Len: 0

No.     Time           Source                Destination           Protocol Length Info
     20 15.193525      192.168.0.10          192.168.0.11          TCP      54     53 → 51905 [RST, ACK] Seq=1 Ack=1 Win=6144 Len=0

Frame 20: 54 bytes on wire (432 bits), 54 bytes captured (432 bits) on interface \Device\NPF_{F1F912BA-5843-4D7F-BEA7-0E733C5F1DA8}, id 0
Ethernet II, Src: ca:58:6a:56:25:c8 (ca:58:6a:56:25:c8), Dst: AzureWaveTec_76:92:9d (14:d4:24:76:92:9d)
Internet Protocol Version 4, Src: 192.168.0.10, Dst: 192.168.0.11
Transmission Control Protocol, Src Port: 53, Dst Port: 51905, Seq: 1, Ack: 1, Len: 0

No.     Time           Source                Destination           Protocol Length Info
     21 15.285836      192.168.0.11          192.168.0.10          DNS      78     Standard query 0x47d3 A ase.aliexpress.com

Frame 21: 78 bytes on wire (624 bits), 78 bytes captured (624 bits) on interface \Device\NPF_{F1F912BA-5843-4D7F-BEA7-0E733C5F1DA8}, id 0
Ethernet II, Src: AzureWaveTec_76:92:9d (14:d4:24:76:92:9d), Dst: ca:58:6a:56:25:c8 (ca:58:6a:56:25:c8)
Internet Protocol Version 4, Src: 192.168.0.11, Dst: 192.168.0.10
User Datagram Protocol, Src Port: 62589, Dst Port: 53
Domain Name System (query)

No.     Time           Source                Destination           Protocol Length Info
     22 15.317482      192.168.0.10          192.168.0.11          DNS      78     Standard query response 0x47d3 No such name A ase.aliexpress.com

Frame 22: 78 bytes on wire (624 bits), 78 bytes captured (624 bits) on interface \Device\NPF_{F1F912BA-5843-4D7F-BEA7-0E733C5F1DA8}, id 0
Ethernet II, Src: ca:58:6a:56:25:c8 (ca:58:6a:56:25:c8), Dst: AzureWaveTec_76:92:9d (14:d4:24:76:92:9d)
Internet Protocol Version 4, Src: 192.168.0.10, Dst: 192.168.0.11
User Datagram Protocol, Src Port: 53, Dst Port: 62589
Domain Name System (response)

No.     Time           Source                Destination           Protocol Length Info
     23 15.317514      192.168.0.11          192.168.0.10          ICMP     106    Destination unreachable (Port unreachable)

Frame 23: 106 bytes on wire (848 bits), 106 bytes captured (848 bits) on interface \Device\NPF_{F1F912BA-5843-4D7F-BEA7-0E733C5F1DA8}, id 0
Ethernet II, Src: AzureWaveTec_76:92:9d (14:d4:24:76:92:9d), Dst: ca:58:6a:56:25:c8 (ca:58:6a:56:25:c8)
Internet Protocol Version 4, Src: 192.168.0.11, Dst: 192.168.0.10
Internet Control Message Protocol

No.     Time           Source                Destination           Protocol Length Info
     24 16.029102      192.168.0.11          192.168.0.10          TCP      59     61361 → 35000 [PSH, ACK] Seq=1 Ack=1 Win=64532 Len=5

Frame 24: 59 bytes on wire (472 bits), 59 bytes captured (472 bits) on interface \Device\NPF_{F1F912BA-5843-4D7F-BEA7-0E733C5F1DA8}, id 0
Ethernet II, Src: AzureWaveTec_76:92:9d (14:d4:24:76:92:9d), Dst: ca:58:6a:56:25:c8 (ca:58:6a:56:25:c8)
Internet Protocol Version 4, Src: 192.168.0.11, Dst: 192.168.0.10
Transmission Control Protocol, Src Port: 61361, Dst Port: 35000, Seq: 1, Ack: 1, Len: 5
Data (5 bytes)

0000  41 54 50 43 0d                                    ATPC.

No.     Time           Source                Destination           Protocol Length Info
     25 16.074500      192.168.0.10          192.168.0.11          TCP      64     35000 → 61361 [PSH, ACK] Seq=1 Ack=6 Win=5934 Len=10

Frame 25: 64 bytes on wire (512 bits), 64 bytes captured (512 bits) on interface \Device\NPF_{F1F912BA-5843-4D7F-BEA7-0E733C5F1DA8}, id 0
Ethernet II, Src: ca:58:6a:56:25:c8 (ca:58:6a:56:25:c8), Dst: AzureWaveTec_76:92:9d (14:d4:24:76:92:9d)
Internet Protocol Version 4, Src: 192.168.0.10, Dst: 192.168.0.11
Transmission Control Protocol, Src Port: 35000, Dst Port: 61361, Seq: 1, Ack: 6, Len: 10
Data (10 bytes)

0000  41 54 50 43 0d 4f 4b 0d 0d 3e                     ATPC.OK..>

No.     Time           Source                Destination           Protocol Length Info
     26 16.078552      192.168.0.11          192.168.0.10          TCP      54     61361 → 35000 [FIN, ACK] Seq=6 Ack=11 Win=64522 Len=0

Frame 26: 54 bytes on wire (432 bits), 54 bytes captured (432 bits) on interface \Device\NPF_{F1F912BA-5843-4D7F-BEA7-0E733C5F1DA8}, id 0
Ethernet II, Src: AzureWaveTec_76:92:9d (14:d4:24:76:92:9d), Dst: ca:58:6a:56:25:c8 (ca:58:6a:56:25:c8)
Internet Protocol Version 4, Src: 192.168.0.11, Dst: 192.168.0.10
Transmission Control Protocol, Src Port: 61361, Dst Port: 35000, Seq: 6, Ack: 11, Len: 0

No.     Time           Source                Destination           Protocol Length Info
     27 16.106416      192.168.0.11          192.168.0.10          DNS      80     Standard query 0x2e59 A events.appsflyer.com

Frame 27: 80 bytes on wire (640 bits), 80 bytes captured (640 bits) on interface \Device\NPF_{F1F912BA-5843-4D7F-BEA7-0E733C5F1DA8}, id 0
Ethernet II, Src: AzureWaveTec_76:92:9d (14:d4:24:76:92:9d), Dst: ca:58:6a:56:25:c8 (ca:58:6a:56:25:c8)
Internet Protocol Version 4, Src: 192.168.0.11, Dst: 192.168.0.10
User Datagram Protocol, Src Port: 55072, Dst Port: 53
Domain Name System (query)

No.     Time           Source                Destination           Protocol Length Info
     28 16.148396      192.168.0.10          192.168.0.11          TCP      54     35000 → 61361 [FIN, ACK] Seq=11 Ack=7 Win=5933 Len=0

Frame 28: 54 bytes on wire (432 bits), 54 bytes captured (432 bits) on interface \Device\NPF_{F1F912BA-5843-4D7F-BEA7-0E733C5F1DA8}, id 0
Ethernet II, Src: ca:58:6a:56:25:c8 (ca:58:6a:56:25:c8), Dst: AzureWaveTec_76:92:9d (14:d4:24:76:92:9d)
Internet Protocol Version 4, Src: 192.168.0.10, Dst: 192.168.0.11
Transmission Control Protocol, Src Port: 35000, Dst Port: 61361, Seq: 11, Ack: 7, Len: 0

No.     Time           Source                Destination           Protocol Length Info
     29 16.148442      192.168.0.11          192.168.0.10          TCP      54     61361 → 35000 [ACK] Seq=7 Ack=12 Win=64522 Len=0

Frame 29: 54 bytes on wire (432 bits), 54 bytes captured (432 bits) on interface \Device\NPF_{F1F912BA-5843-4D7F-BEA7-0E733C5F1DA8}, id 0
Ethernet II, Src: AzureWaveTec_76:92:9d (14:d4:24:76:92:9d), Dst: ca:58:6a:56:25:c8 (ca:58:6a:56:25:c8)
Internet Protocol Version 4, Src: 192.168.0.11, Dst: 192.168.0.10
Transmission Control Protocol, Src Port: 61361, Dst Port: 35000, Seq: 7, Ack: 12, Len: 0

No.     Time           Source                Destination           Protocol Length Info
     30 16.159683      192.168.0.10          192.168.0.11          DNS      80     Standard query response 0x2e59 No such name A events.appsflyer.com

Frame 30: 80 bytes on wire (640 bits), 80 bytes captured (640 bits) on interface \Device\NPF_{F1F912BA-5843-4D7F-BEA7-0E733C5F1DA8}, id 0
Ethernet II, Src: ca:58:6a:56:25:c8 (ca:58:6a:56:25:c8), Dst: AzureWaveTec_76:92:9d (14:d4:24:76:92:9d)
Internet Protocol Version 4, Src: 192.168.0.10, Dst: 192.168.0.11
User Datagram Protocol, Src Port: 53, Dst Port: 55072
Domain Name System (response)

No.     Time           Source                Destination           Protocol Length Info
     31 16.159743      192.168.0.11          192.168.0.10          ICMP     108    Destination unreachable (Port unreachable)

Frame 31: 108 bytes on wire (864 bits), 108 bytes captured (864 bits) on interface \Device\NPF_{F1F912BA-5843-4D7F-BEA7-0E733C5F1DA8}, id 0
Ethernet II, Src: AzureWaveTec_76:92:9d (14:d4:24:76:92:9d), Dst: ca:58:6a:56:25:c8 (ca:58:6a:56:25:c8)
Internet Protocol Version 4, Src: 192.168.0.11, Dst: 192.168.0.10
Internet Control Message Protocol

No.     Time           Source                Destination           Protocol Length Info
     32 16.652760      192.168.0.11          23.195.99.205         TCP      66     [TCP Retransmission] 60424 → 80 [SYN] Seq=0 Win=65535 Len=0 MSS=1460 WS=256 SACK_PERM

Frame 32: 66 bytes on wire (528 bits), 66 bytes captured (528 bits) on interface \Device\NPF_{F1F912BA-5843-4D7F-BEA7-0E733C5F1DA8}, id 0
Ethernet II, Src: AzureWaveTec_76:92:9d (14:d4:24:76:92:9d), Dst: ca:58:6a:56:25:c8 (ca:58:6a:56:25:c8)
Internet Protocol Version 4, Src: 192.168.0.11, Dst: 23.195.99.205
Transmission Control Protocol, Src Port: 60424, Dst Port: 80, Seq: 0, Len: 0

No.     Time           Source                Destination           Protocol Length Info
     33 16.652820      192.168.0.11          23.195.99.205         TCP      66     [TCP Retransmission] 60425 → 80 [SYN] Seq=0 Win=65535 Len=0 MSS=1460 WS=256 SACK_PERM

Frame 33: 66 bytes on wire (528 bits), 66 bytes captured (528 bits) on interface \Device\NPF_{F1F912BA-5843-4D7F-BEA7-0E733C5F1DA8}, id 0
Ethernet II, Src: AzureWaveTec_76:92:9d (14:d4:24:76:92:9d), Dst: ca:58:6a:56:25:c8 (ca:58:6a:56:25:c8)
Internet Protocol Version 4, Src: 192.168.0.11, Dst: 23.195.99.205
Transmission Control Protocol, Src Port: 60425, Dst Port: 80, Seq: 0, Len: 0

No.     Time           Source                Destination           Protocol Length Info
     34 17.938266      192.168.0.11          192.168.0.10          TCP      66     64429 → 35000 [SYN] Seq=0 Win=65535 Len=0 MSS=1460 WS=256 SACK_PERM

Frame 34: 66 bytes on wire (528 bits), 66 bytes captured (528 bits) on interface \Device\NPF_{F1F912BA-5843-4D7F-BEA7-0E733C5F1DA8}, id 0
Ethernet II, Src: AzureWaveTec_76:92:9d (14:d4:24:76:92:9d), Dst: ca:58:6a:56:25:c8 (ca:58:6a:56:25:c8)
Internet Protocol Version 4, Src: 192.168.0.11, Dst: 192.168.0.10
Transmission Control Protocol, Src Port: 64429, Dst Port: 35000, Seq: 0, Len: 0

No.     Time           Source                Destination           Protocol Length Info
     35 17.941194      192.168.0.10          192.168.0.11          TCP      58     35000 → 64429 [SYN, ACK] Seq=0 Ack=1 Win=6144 Len=0 MSS=1024

Frame 35: 58 bytes on wire (464 bits), 58 bytes captured (464 bits) on interface \Device\NPF_{F1F912BA-5843-4D7F-BEA7-0E733C5F1DA8}, id 0
Ethernet II, Src: ca:58:6a:56:25:c8 (ca:58:6a:56:25:c8), Dst: AzureWaveTec_76:92:9d (14:d4:24:76:92:9d)
Internet Protocol Version 4, Src: 192.168.0.10, Dst: 192.168.0.11
Transmission Control Protocol, Src Port: 35000, Dst Port: 64429, Seq: 0, Ack: 1, Len: 0

No.     Time           Source                Destination           Protocol Length Info
     36 17.941262      192.168.0.11          192.168.0.10          TCP      54     64429 → 35000 [ACK] Seq=1 Ack=1 Win=65535 Len=0

Frame 36: 54 bytes on wire (432 bits), 54 bytes captured (432 bits) on interface \Device\NPF_{F1F912BA-5843-4D7F-BEA7-0E733C5F1DA8}, id 0
Ethernet II, Src: AzureWaveTec_76:92:9d (14:d4:24:76:92:9d), Dst: ca:58:6a:56:25:c8 (ca:58:6a:56:25:c8)
Internet Protocol Version 4, Src: 192.168.0.11, Dst: 192.168.0.10
Transmission Control Protocol, Src Port: 64429, Dst Port: 35000, Seq: 1, Ack: 1, Len: 0

No.     Time           Source                Destination           Protocol Length Info
     37 18.457274      192.168.0.11          192.168.0.10          TCP      58     64429 → 35000 [PSH, ACK] Seq=1 Ack=1 Win=65535 Len=4

Frame 37: 58 bytes on wire (464 bits), 58 bytes captured (464 bits) on interface \Device\NPF_{F1F912BA-5843-4D7F-BEA7-0E733C5F1DA8}, id 0
Ethernet II, Src: AzureWaveTec_76:92:9d (14:d4:24:76:92:9d), Dst: ca:58:6a:56:25:c8 (ca:58:6a:56:25:c8)
Internet Protocol Version 4, Src: 192.168.0.11, Dst: 192.168.0.10
Transmission Control Protocol, Src Port: 64429, Dst Port: 35000, Seq: 1, Ack: 1, Len: 4
Data (4 bytes)

0000  41 54 49 0d                                       ATI.

No.     Time           Source                Destination           Protocol Length Info
     38 18.519948      192.168.0.10          192.168.0.11          TCP      72     35000 → 64429 [PSH, ACK] Seq=1 Ack=5 Win=6140 Len=18

Frame 38: 72 bytes on wire (576 bits), 72 bytes captured (576 bits) on interface \Device\NPF_{F1F912BA-5843-4D7F-BEA7-0E733C5F1DA8}, id 0
Ethernet II, Src: ca:58:6a:56:25:c8 (ca:58:6a:56:25:c8), Dst: AzureWaveTec_76:92:9d (14:d4:24:76:92:9d)
Internet Protocol Version 4, Src: 192.168.0.10, Dst: 192.168.0.11
Transmission Control Protocol, Src Port: 35000, Dst Port: 64429, Seq: 1, Ack: 5, Len: 18
Data (18 bytes)

0000  41 54 49 0d 20 4f 42 44 49 49 20 76 31 2e 35 0d   ATI. OBDII v1.5.
0010  0d 3e                                             .>

No.     Time           Source                Destination           Protocol Length Info
     39 18.527144      192.168.0.11          192.168.0.10          TCP      58     64429 → 35000 [PSH, ACK] Seq=5 Ack=19 Win=65517 Len=4

Frame 39: 58 bytes on wire (464 bits), 58 bytes captured (464 bits) on interface \Device\NPF_{F1F912BA-5843-4D7F-BEA7-0E733C5F1DA8}, id 0
Ethernet II, Src: AzureWaveTec_76:92:9d (14:d4:24:76:92:9d), Dst: ca:58:6a:56:25:c8 (ca:58:6a:56:25:c8)
Internet Protocol Version 4, Src: 192.168.0.11, Dst: 192.168.0.10
Transmission Control Protocol, Src Port: 64429, Dst Port: 35000, Seq: 5, Ack: 19, Len: 4
Data (4 bytes)

0000  41 54 5a 0d                                       ATZ.

No.     Time           Source                Destination           Protocol Length Info
     40 18.599438      192.168.0.10          192.168.0.11          TCP      59     35000 → 64429 [PSH, ACK] Seq=19 Ack=9 Win=6136 Len=5

Frame 40: 59 bytes on wire (472 bits), 59 bytes captured (472 bits) on interface \Device\NPF_{F1F912BA-5843-4D7F-BEA7-0E733C5F1DA8}, id 0
Ethernet II, Src: ca:58:6a:56:25:c8 (ca:58:6a:56:25:c8), Dst: AzureWaveTec_76:92:9d (14:d4:24:76:92:9d)
Internet Protocol Version 4, Src: 192.168.0.10, Dst: 192.168.0.11
Transmission Control Protocol, Src Port: 35000, Dst Port: 64429, Seq: 19, Ack: 9, Len: 5
Data (5 bytes)

0000  41 54 5a 0d fc                                    ATZ..

No.     Time           Source                Destination           Protocol Length Info
     41 18.654153      192.168.0.11          192.168.0.10          TCP      54     64429 → 35000 [ACK] Seq=9 Ack=24 Win=65512 Len=0

Frame 41: 54 bytes on wire (432 bits), 54 bytes captured (432 bits) on interface \Device\NPF_{F1F912BA-5843-4D7F-BEA7-0E733C5F1DA8}, id 0
Ethernet II, Src: AzureWaveTec_76:92:9d (14:d4:24:76:92:9d), Dst: ca:58:6a:56:25:c8 (ca:58:6a:56:25:c8)
Internet Protocol Version 4, Src: 192.168.0.11, Dst: 192.168.0.10
Transmission Control Protocol, Src Port: 64429, Dst Port: 35000, Seq: 9, Ack: 24, Len: 0

No.     Time           Source                Destination           Protocol Length Info
     42 19.185637      192.168.0.11          192.168.0.10          DNS      76     Standard query 0x6c1f A gator.volces.com

Frame 42: 76 bytes on wire (608 bits), 76 bytes captured (608 bits) on interface \Device\NPF_{F1F912BA-5843-4D7F-BEA7-0E733C5F1DA8}, id 0
Ethernet II, Src: AzureWaveTec_76:92:9d (14:d4:24:76:92:9d), Dst: ca:58:6a:56:25:c8 (ca:58:6a:56:25:c8)
Internet Protocol Version 4, Src: 192.168.0.11, Dst: 192.168.0.10
User Datagram Protocol, Src Port: 57179, Dst Port: 53
Domain Name System (query)

No.     Time           Source                Destination           Protocol Length Info
     43 19.227398      192.168.0.11          192.168.0.10          DNS      76     Standard query 0x6c1f A gator.volces.com

Frame 43: 76 bytes on wire (608 bits), 76 bytes captured (608 bits) on interface \Device\NPF_{F1F912BA-5843-4D7F-BEA7-0E733C5F1DA8}, id 0
Ethernet II, Src: AzureWaveTec_76:92:9d (14:d4:24:76:92:9d), Dst: ca:58:6a:56:25:c8 (ca:58:6a:56:25:c8)
Internet Protocol Version 4, Src: 192.168.0.11, Dst: 192.168.0.10
User Datagram Protocol, Src Port: 57179, Dst Port: 53
Domain Name System (query)

No.     Time           Source                Destination           Protocol Length Info
     44 19.268223      192.168.0.10          192.168.0.11          DNS      76     Standard query response 0x6c1f No such name A gator.volces.com

Frame 44: 76 bytes on wire (608 bits), 76 bytes captured (608 bits) on interface \Device\NPF_{F1F912BA-5843-4D7F-BEA7-0E733C5F1DA8}, id 0
Ethernet II, Src: ca:58:6a:56:25:c8 (ca:58:6a:56:25:c8), Dst: AzureWaveTec_76:92:9d (14:d4:24:76:92:9d)
Internet Protocol Version 4, Src: 192.168.0.10, Dst: 192.168.0.11
User Datagram Protocol, Src Port: 53, Dst Port: 57179
Domain Name System (response)

No.     Time           Source                Destination           Protocol Length Info
     45 19.268258      192.168.0.11          192.168.0.10          ICMP     104    Destination unreachable (Port unreachable)

Frame 45: 104 bytes on wire (832 bits), 104 bytes captured (832 bits) on interface \Device\NPF_{F1F912BA-5843-4D7F-BEA7-0E733C5F1DA8}, id 0
Ethernet II, Src: AzureWaveTec_76:92:9d (14:d4:24:76:92:9d), Dst: ca:58:6a:56:25:c8 (ca:58:6a:56:25:c8)
Internet Protocol Version 4, Src: 192.168.0.11, Dst: 192.168.0.10
Internet Control Message Protocol

No.     Time           Source                Destination           Protocol Length Info
     46 19.388913      192.168.0.10          192.168.0.11          TCP      70     35000 → 64429 [PSH, ACK] Seq=24 Ack=9 Win=6136 Len=16

Frame 46: 70 bytes on wire (560 bits), 70 bytes captured (560 bits) on interface \Device\NPF_{F1F912BA-5843-4D7F-BEA7-0E733C5F1DA8}, id 0
Ethernet II, Src: ca:58:6a:56:25:c8 (ca:58:6a:56:25:c8), Dst: AzureWaveTec_76:92:9d (14:d4:24:76:92:9d)
Internet Protocol Version 4, Src: 192.168.0.10, Dst: 192.168.0.11
Transmission Control Protocol, Src Port: 35000, Dst Port: 64429, Seq: 24, Ack: 9, Len: 16
Data (16 bytes)

0000  0d 0d 20 4f 42 44 49 49 20 76 31 2e 35 0d 0d 3e   .. OBDII v1.5..>

No.     Time           Source                Destination           Protocol Length Info
     47 19.390806      192.168.0.11          192.168.0.10          TCP      59     64429 → 35000 [PSH, ACK] Seq=9 Ack=40 Win=65496 Len=5

Frame 47: 59 bytes on wire (472 bits), 59 bytes captured (472 bits) on interface \Device\NPF_{F1F912BA-5843-4D7F-BEA7-0E733C5F1DA8}, id 0
Ethernet II, Src: AzureWaveTec_76:92:9d (14:d4:24:76:92:9d), Dst: ca:58:6a:56:25:c8 (ca:58:6a:56:25:c8)
Internet Protocol Version 4, Src: 192.168.0.11, Dst: 192.168.0.10
Transmission Control Protocol, Src Port: 64429, Dst Port: 35000, Seq: 9, Ack: 40, Len: 5
Data (5 bytes)

0000  41 54 50 43 0d                                    ATPC.

No.     Time           Source                Destination           Protocol Length Info
     48 19.439004      192.168.0.10          192.168.0.11          TCP      64     35000 → 64429 [PSH, ACK] Seq=40 Ack=14 Win=6131 Len=10

Frame 48: 64 bytes on wire (512 bits), 64 bytes captured (512 bits) on interface \Device\NPF_{F1F912BA-5843-4D7F-BEA7-0E733C5F1DA8}, id 0
Ethernet II, Src: ca:58:6a:56:25:c8 (ca:58:6a:56:25:c8), Dst: AzureWaveTec_76:92:9d (14:d4:24:76:92:9d)
Internet Protocol Version 4, Src: 192.168.0.10, Dst: 192.168.0.11
Transmission Control Protocol, Src Port: 35000, Dst Port: 64429, Seq: 40, Ack: 14, Len: 10
Data (10 bytes)

0000  41 54 50 43 0d 4f 4b 0d 0d 3e                     ATPC.OK..>

No.     Time           Source                Destination           Protocol Length Info
     49 19.440674      192.168.0.11          192.168.0.10          TCP      58     64429 → 35000 [PSH, ACK] Seq=14 Ack=50 Win=65486 Len=4

Frame 49: 58 bytes on wire (464 bits), 58 bytes captured (464 bits) on interface \Device\NPF_{F1F912BA-5843-4D7F-BEA7-0E733C5F1DA8}, id 0
Ethernet II, Src: AzureWaveTec_76:92:9d (14:d4:24:76:92:9d), Dst: ca:58:6a:56:25:c8 (ca:58:6a:56:25:c8)
Internet Protocol Version 4, Src: 192.168.0.11, Dst: 192.168.0.10
Transmission Control Protocol, Src Port: 64429, Dst Port: 35000, Seq: 14, Ack: 50, Len: 4
Data (4 bytes)

0000  41 54 49 0d                                       ATI.

No.     Time           Source                Destination           Protocol Length Info
     50 19.478615      192.168.0.10          192.168.0.11          TCP      54     35000 → 64429 [ACK] Seq=50 Ack=18 Win=6127 Len=0

Frame 50: 54 bytes on wire (432 bits), 54 bytes captured (432 bits) on interface \Device\NPF_{F1F912BA-5843-4D7F-BEA7-0E733C5F1DA8}, id 0
Ethernet II, Src: ca:58:6a:56:25:c8 (ca:58:6a:56:25:c8), Dst: AzureWaveTec_76:92:9d (14:d4:24:76:92:9d)
Internet Protocol Version 4, Src: 192.168.0.10, Dst: 192.168.0.11
Transmission Control Protocol, Src Port: 35000, Dst Port: 64429, Seq: 50, Ack: 18, Len: 0

No.     Time           Source                Destination           Protocol Length Info
     51 19.482999      192.168.0.10          192.168.0.11          TCP      72     35000 → 64429 [PSH, ACK] Seq=50 Ack=18 Win=6127 Len=18

Frame 51: 72 bytes on wire (576 bits), 72 bytes captured (576 bits) on interface \Device\NPF_{F1F912BA-5843-4D7F-BEA7-0E733C5F1DA8}, id 0
Ethernet II, Src: ca:58:6a:56:25:c8 (ca:58:6a:56:25:c8), Dst: AzureWaveTec_76:92:9d (14:d4:24:76:92:9d)
Internet Protocol Version 4, Src: 192.168.0.10, Dst: 192.168.0.11
Transmission Control Protocol, Src Port: 35000, Dst Port: 64429, Seq: 50, Ack: 18, Len: 18
Data (18 bytes)

0000  41 54 49 0d 20 4f 42 44 49 49 20 76 31 2e 35 0d   ATI. OBDII v1.5.
0010  0d 3e                                             .>

No.     Time           Source                Destination           Protocol Length Info
     52 19.484762      192.168.0.11          192.168.0.10          TCP      61     64429 → 35000 [PSH, ACK] Seq=18 Ack=68 Win=65468 Len=7

Frame 52: 61 bytes on wire (488 bits), 61 bytes captured (488 bits) on interface \Device\NPF_{F1F912BA-5843-4D7F-BEA7-0E733C5F1DA8}, id 0
Ethernet II, Src: AzureWaveTec_76:92:9d (14:d4:24:76:92:9d), Dst: ca:58:6a:56:25:c8 (ca:58:6a:56:25:c8)
Internet Protocol Version 4, Src: 192.168.0.11, Dst: 192.168.0.10
Transmission Control Protocol, Src Port: 64429, Dst Port: 35000, Seq: 18, Ack: 68, Len: 7
Data (7 bytes)

0000  41 54 53 50 20 30 0d                              ATSP 0.

No.     Time           Source                Destination           Protocol Length Info
     53 19.544716      192.168.0.10          192.168.0.11          TCP      66     35000 → 64429 [PSH, ACK] Seq=68 Ack=25 Win=6120 Len=12

Frame 53: 66 bytes on wire (528 bits), 66 bytes captured (528 bits) on interface \Device\NPF_{F1F912BA-5843-4D7F-BEA7-0E733C5F1DA8}, id 0
Ethernet II, Src: ca:58:6a:56:25:c8 (ca:58:6a:56:25:c8), Dst: AzureWaveTec_76:92:9d (14:d4:24:76:92:9d)
Internet Protocol Version 4, Src: 192.168.0.10, Dst: 192.168.0.11
Transmission Control Protocol, Src Port: 35000, Dst Port: 64429, Seq: 68, Ack: 25, Len: 12
Data (12 bytes)

0000  41 54 53 50 20 30 0d 4f 4b 0d 0d 3e               ATSP 0.OK..>

No.     Time           Source                Destination           Protocol Length Info
     54 19.546407      192.168.0.11          192.168.0.10          TCP      59     64429 → 35000 [PSH, ACK] Seq=25 Ack=80 Win=65456 Len=5

Frame 54: 59 bytes on wire (472 bits), 59 bytes captured (472 bits) on interface \Device\NPF_{F1F912BA-5843-4D7F-BEA7-0E733C5F1DA8}, id 0
Ethernet II, Src: AzureWaveTec_76:92:9d (14:d4:24:76:92:9d), Dst: ca:58:6a:56:25:c8 (ca:58:6a:56:25:c8)
Internet Protocol Version 4, Src: 192.168.0.11, Dst: 192.168.0.10
Transmission Control Protocol, Src Port: 64429, Dst Port: 35000, Seq: 25, Ack: 80, Len: 5
Data (5 bytes)

0000  41 54 48 31 0d                                    ATH1.

No.     Time           Source                Destination           Protocol Length Info
     55 19.588438      192.168.0.10          192.168.0.11          TCP      64     35000 → 64429 [PSH, ACK] Seq=80 Ack=30 Win=6115 Len=10

Frame 55: 64 bytes on wire (512 bits), 64 bytes captured (512 bits) on interface \Device\NPF_{F1F912BA-5843-4D7F-BEA7-0E733C5F1DA8}, id 0
Ethernet II, Src: ca:58:6a:56:25:c8 (ca:58:6a:56:25:c8), Dst: AzureWaveTec_76:92:9d (14:d4:24:76:92:9d)
Internet Protocol Version 4, Src: 192.168.0.10, Dst: 192.168.0.11
Transmission Control Protocol, Src Port: 35000, Dst Port: 64429, Seq: 80, Ack: 30, Len: 10
Data (10 bytes)

0000  41 54 48 31 0d 4f 4b 0d 0d 3e                     ATH1.OK..>

No.     Time           Source                Destination           Protocol Length Info
     56 19.590002      192.168.0.11          192.168.0.10          TCP      59     64429 → 35000 [PSH, ACK] Seq=30 Ack=90 Win=65446 Len=5

Frame 56: 59 bytes on wire (472 bits), 59 bytes captured (472 bits) on interface \Device\NPF_{F1F912BA-5843-4D7F-BEA7-0E733C5F1DA8}, id 0
Ethernet II, Src: AzureWaveTec_76:92:9d (14:d4:24:76:92:9d), Dst: ca:58:6a:56:25:c8 (ca:58:6a:56:25:c8)
Internet Protocol Version 4, Src: 192.168.0.11, Dst: 192.168.0.10
Transmission Control Protocol, Src Port: 64429, Dst Port: 35000, Seq: 30, Ack: 90, Len: 5
Data (5 bytes)

0000  30 31 30 30 0d                                    0100.

No.     Time           Source                Destination           Protocol Length Info
     57 19.650047      192.168.0.10          192.168.0.11          TCP      98     35000 → 64429 [PSH, ACK] Seq=90 Ack=35 Win=6110 Len=44

Frame 57: 98 bytes on wire (784 bits), 98 bytes captured (784 bits) on interface \Device\NPF_{F1F912BA-5843-4D7F-BEA7-0E733C5F1DA8}, id 0
Ethernet II, Src: ca:58:6a:56:25:c8 (ca:58:6a:56:25:c8), Dst: AzureWaveTec_76:92:9d (14:d4:24:76:92:9d)
Internet Protocol Version 4, Src: 192.168.0.10, Dst: 192.168.0.11
Transmission Control Protocol, Src Port: 35000, Dst Port: 64429, Seq: 90, Ack: 35, Len: 44
Data (44 bytes)

0000  30 31 30 30 0d 53 45 41 52 43 48 49 4e 47 2e 2e   0100.SEARCHING..
0010  2e 0d 37 45 38 20 30 36 20 34 31 20 30 30 20 39   ..7E8 06 41 00 9
0020  38 20 33 42 20 38 30 20 31 33 20 0d               8 3B 80 13 .

No.     Time           Source                Destination           Protocol Length Info
     58 19.691634      192.168.0.11          192.168.0.10          TCP      54     64429 → 35000 [ACK] Seq=35 Ack=134 Win=65402 Len=0

Frame 58: 54 bytes on wire (432 bits), 54 bytes captured (432 bits) on interface \Device\NPF_{F1F912BA-5843-4D7F-BEA7-0E733C5F1DA8}, id 0
Ethernet II, Src: AzureWaveTec_76:92:9d (14:d4:24:76:92:9d), Dst: ca:58:6a:56:25:c8 (ca:58:6a:56:25:c8)
Internet Protocol Version 4, Src: 192.168.0.11, Dst: 192.168.0.10
Transmission Control Protocol, Src Port: 64429, Dst Port: 35000, Seq: 35, Ack: 134, Len: 0

No.     Time           Source                Destination           Protocol Length Info
     59 19.842319      192.168.0.10          192.168.0.11          TCP      56     35000 → 64429 [PSH, ACK] Seq=134 Ack=35 Win=6110 Len=2

Frame 59: 56 bytes on wire (448 bits), 56 bytes captured (448 bits) on interface \Device\NPF_{F1F912BA-5843-4D7F-BEA7-0E733C5F1DA8}, id 0
Ethernet II, Src: ca:58:6a:56:25:c8 (ca:58:6a:56:25:c8), Dst: AzureWaveTec_76:92:9d (14:d4:24:76:92:9d)
Internet Protocol Version 4, Src: 192.168.0.10, Dst: 192.168.0.11
Transmission Control Protocol, Src Port: 35000, Dst Port: 64429, Seq: 134, Ack: 35, Len: 2
Data (2 bytes)

0000  0d 3e                                             .>

No.     Time           Source                Destination           Protocol Length Info
     60 19.854920      192.168.0.11          192.168.0.10          TCP      60     64429 → 35000 [PSH, ACK] Seq=35 Ack=136 Win=65400 Len=6

Frame 60: 60 bytes on wire (480 bits), 60 bytes captured (480 bits) on interface \Device\NPF_{F1F912BA-5843-4D7F-BEA7-0E733C5F1DA8}, id 0
Ethernet II, Src: AzureWaveTec_76:92:9d (14:d4:24:76:92:9d), Dst: ca:58:6a:56:25:c8 (ca:58:6a:56:25:c8)
Internet Protocol Version 4, Src: 192.168.0.11, Dst: 192.168.0.10
Transmission Control Protocol, Src Port: 64429, Dst Port: 35000, Seq: 35, Ack: 136, Len: 6
Data (6 bytes)

0000  41 54 44 50 4e 0d                                 ATDPN.

No.     Time           Source                Destination           Protocol Length Info
     61 19.904083      192.168.0.10          192.168.0.11          TCP      65     35000 → 64429 [PSH, ACK] Seq=136 Ack=41 Win=6104 Len=11

Frame 61: 65 bytes on wire (520 bits), 65 bytes captured (520 bits) on interface \Device\NPF_{F1F912BA-5843-4D7F-BEA7-0E733C5F1DA8}, id 0
Ethernet II, Src: ca:58:6a:56:25:c8 (ca:58:6a:56:25:c8), Dst: AzureWaveTec_76:92:9d (14:d4:24:76:92:9d)
Internet Protocol Version 4, Src: 192.168.0.10, Dst: 192.168.0.11
Transmission Control Protocol, Src Port: 35000, Dst Port: 64429, Seq: 136, Ack: 41, Len: 11
Data (11 bytes)

0000  41 54 44 50 4e 0d 41 36 0d 0d 3e                  ATDPN.A6..>

No.     Time           Source                Destination           Protocol Length Info
